provider_id,post_id,user_id,song_id,album_id,description,created_at
Spotify,0,260,125,,Trade north less well floor enter mission.,2023-12-08 18:55:46
Spotify,1,135,,11,Water see special budget.,2024-10-10 01:57:14
Spotify,2,367,94,,Able nearly space actually three.,2024-04-15 16:40:40
Spotify,3,18,108,,Gas mention condition task of full energy.,2024-07-03 13:18:01
Spotify,4,228,,1,From break dream back.,2024-05-12 00:13:33
Spotify,5,134,,1,Great face method production reason.,2024-10-05 22:02:25
Spotify,6,314,,15,Try challenge so worry speak let.,2024-08-21 02:31:47
Spotify,7,196,143,,Summer site your economic include he beat.,2024-03-18 06:35:45
Spotify,8,168,,9,Walk school accept market civil.,2023-11-30 05:00:33
Spotify,9,247,145,,Choose they white teach score medical.,2024-01-02 00:37:31
Spotify,10,186,64,,Future image first indicate not.,2024-07-22 21:35:37
Spotify,11,292,,15,Age ability billion sister cup each.,2024-11-04 08:18:08
Spotify,12,274,,16,New none section painting man.,2024-09-16 11:50:36
Spotify,13,88,138,,Put pass deep truth enjoy social his.,2024-01-30 18:25:50
Spotify,14,33,193,,Seem result shake social dream.,2024-01-27 23:26:29
Spotify,15,246,,7,Cup word produce however war action fine fire.,2024-07-06 09:31:02
Spotify,16,255,,3,General force possible role commercial.,2024-01-27 14:47:45
Spotify,17,31,36,,Because against research to thus positive.,2024-04-19 06:39:49
Spotify,18,22,114,,Performance already moment.,2024-04-21 16:08:12
Spotify,19,331,33,,Base drug lawyer owner two.,2024-02-04 15:10:11
Spotify,20,91,,18,Concern dog vote section major.,2024-07-31 09:45:35
Spotify,21,138,,12,Either candidate story dark per heavy.,2024-07-05 10:08:04
Spotify,22,328,110,,Message major own.,2024-06-07 14:51:03
Spotify,23,329,,10,Floor raise around keep.,2023-12-25 09:42:27
Spotify,24,177,,9,His yes as. Official artist beyond.,2023-11-25 00:11:55
Spotify,25,166,50,,Society well middle body public.,2024-04-14 17:43:47
Spotify,26,138,,13,Any contain himself tax big marriage concern.,2024-04-16 07:35:15
Spotify,27,27,80,,Maybe television skin happen.,2024-09-23 17:15:45
Spotify,28,182,80,,Them financial center grow.,2024-02-01 09:58:47
Spotify,29,346,47,,Agency dark see citizen.,2024-07-01 19:10:48
Spotify,30,21,,3,Listen game pass. Parent color meet dream.,2024-01-30 02:57:50
Spotify,31,121,105,,Near general health deal history.,2024-05-10 19:27:31
Spotify,32,8,,14,Among color factor prove.,2024-06-13 08:43:43
Spotify,33,20,,18,Campaign tough brother employee firm.,2024-01-10 05:04:47
Spotify,34,130,38,,Along standard ball way how kitchen white.,2023-12-21 21:03:29
Spotify,35,366,26,,Move agreement international.,2024-09-13 16:18:40
Spotify,36,258,,1,Pretty most group dinner nature threat reach.,2024-11-17 06:56:58
Spotify,37,360,19,,Continue field sense leader situation.,2024-09-27 08:50:44
Spotify,38,277,,10,Through soon control. Thank value this ahead.,2024-03-20 13:17:47
Spotify,39,243,,13,Risk work believe Mr hope society station pass.,2024-01-13 16:35:25
Spotify,40,347,,6,Explain speech really trial.,2024-02-09 09:43:56
Spotify,41,17,107,,Seat food American dream.,2024-03-26 03:33:18
Spotify,42,280,,10,Land board space.,2023-12-22 17:20:36
Spotify,43,242,54,,Tend high reduce across hour.,2024-04-23 18:51:15
Spotify,44,222,,2,Speak subject live development.,2024-10-26 16:11:40
Spotify,45,374,43,,Those production Congress practice most.,2024-05-06 13:29:38
Spotify,46,87,27,,Girl sure south.,2023-11-24 15:09:01
Spotify,47,267,,6,Claim spend two expect want.,2024-11-18 12:21:15
Spotify,48,239,,10,Out attack the ability kind few.,2024-02-17 21:43:16
Spotify,49,236,,17,Decade heart avoid sort. Lot friend great.,2024-04-01 09:11:40
Spotify,50,379,12,,Whether agent test throw.,2024-10-27 03:40:55
Spotify,51,36,,4,Her under when. Example guy pick practice spend.,2024-01-30 18:43:00
Spotify,52,43,,2,Already movement point while.,2024-09-15 19:58:42
Spotify,53,110,36,,Wish occur source build.,2023-12-16 17:07:07
Spotify,54,393,,1,Gun anyone behind painting chance wish.,2024-01-24 03:58:01
Spotify,55,376,,12,Computer expect race strong whose.,2024-05-20 17:50:57
Spotify,56,264,96,,Ask dinner statement yet third deal respond.,2024-03-12 13:01:57
Spotify,57,384,,13,Nothing PM relationship daughter.,2024-06-01 11:40:14
Spotify,58,389,,16,Candidate candidate standard answer always arm.,2024-10-03 07:42:10
Spotify,59,73,55,,Hour value old first wait operation.,2024-08-23 02:59:57
Spotify,60,232,117,,Which about entire him society.,2024-01-19 12:03:27
Spotify,61,364,6,,Work environment per direction.,2023-12-08 07:14:22
Spotify,62,193,24,,Necessary sign alone same result eat.,2024-05-03 05:38:46
Spotify,63,371,,18,House young pick reach do.,2024-06-28 08:35:34
Spotify,64,346,172,,Fire apply civil trial. Second serve begin.,2024-01-11 03:41:51
Spotify,65,163,1,,With feeling garden should soon within.,2024-07-02 04:51:25
Spotify,66,43,12,,Investment doctor billion dream investment.,2024-01-04 10:33:21
Spotify,67,221,123,,Garden kitchen left travel.,2024-06-11 04:05:32
Spotify,68,71,83,,Easy kid art manage edge.,2024-01-20 12:56:36
Spotify,69,153,,10,Race approach serve support hospital machine.,2024-03-03 04:20:29
Spotify,70,90,,12,Answer those budget. Nearly game major accept.,2024-01-28 06:54:59
Spotify,71,347,,8,Guy support century up.,2024-02-08 00:25:37
Spotify,72,92,,9,Reach during maybe action strong against.,2024-02-10 13:47:38
Spotify,73,27,,1,Peace consider walk walk. Guess on meeting.,2024-09-20 01:56:24
Spotify,74,401,159,,Because difficult happy share product guess.,2024-06-13 21:01:54
Spotify,75,208,22,,Claim number ago once perhaps institution.,2024-04-14 08:20:07
Spotify,76,68,,13,Right size wrong debate these firm.,2024-01-11 14:09:48
Spotify,77,331,116,,List little feel south east cover might mother.,2024-07-02 16:51:20
Spotify,78,3,23,,Drug blood media art although including.,2024-06-08 23:31:01
Spotify,79,197,,15,Tree play imagine. Trial water anything.,2024-07-30 18:23:47
Spotify,80,375,101,,Wonder ago page his.,2023-11-20 20:15:12
Spotify,81,384,,18,Reason design election second society white.,2024-11-15 19:00:43
Spotify,82,78,,2,Husband skin almost live PM cultural employee.,2024-06-08 02:59:05
Spotify,83,80,184,,Visit vote pressure eight.,2024-07-18 08:06:22
Spotify,84,37,62,,Character space never left second enjoy we.,2024-05-18 15:12:45
Spotify,85,110,190,,Example mean through form.,2024-10-23 00:23:10
Spotify,86,214,,16,Pm stop goal feel performance ask happen.,2024-08-03 03:13:46
Spotify,87,259,132,,Trial father fund describe.,2024-09-16 15:16:10
Spotify,88,217,92,,Purpose name family born you evidence pretty.,2024-07-26 03:51:25
Spotify,89,316,147,,Name recent bag tough.,2024-06-23 11:36:03
Spotify,90,184,,16,Yeah well successful yet light.,2024-02-17 06:59:13
Spotify,91,374,170,,Need less old young economy.,2024-10-22 17:25:15
Spotify,92,21,,18,Nothing goal suddenly thought another.,2024-07-17 12:15:08
Spotify,93,36,,16,Page job close move carry both tend Mrs.,2024-08-07 04:48:22
Spotify,94,33,95,,This together inside it international.,2023-11-27 14:05:30
Spotify,95,314,,11,Recognize leader leader bar.,2024-05-13 03:05:58
Spotify,96,262,1,,Not forget cover true up star body dog.,2023-12-06 01:28:58
Spotify,97,2,80,,May successful decision out weight.,2024-10-03 23:20:35
Spotify,98,48,,5,Company member reflect ahead it hospital.,2024-06-26 07:36:30
Spotify,99,166,,7,American draw peace protect leg.,2024-07-07 17:29:57
Spotify,100,312,,4,Large shoulder tax better nearly cut word.,2024-07-18 01:23:06
Spotify,101,175,,14,Enjoy tough yeah lawyer.,2024-04-14 06:56:19
Spotify,102,2,143,,Game game hand assume quickly piece thing.,2024-04-17 07:52:01
Spotify,103,113,9,,Appear start she collection.,2023-12-15 04:39:08
Spotify,104,193,,11,Rise than treat loss nearly.,2024-02-02 20:11:09
Spotify,105,263,,18,Home color maybe catch there air.,2024-07-19 00:33:02
Spotify,106,196,,1,Save west ahead same management human offer.,2024-04-14 21:04:47
Spotify,107,267,3,,Word or different.,2024-11-10 11:09:34
Spotify,108,373,160,,Walk run over blood.,2024-08-22 09:36:17
Spotify,109,296,,11,Memory young big.,2024-05-02 20:14:20
Spotify,110,214,,17,White couple protect air.,2024-10-10 07:20:10
Spotify,111,313,115,,Democrat ask fine go whom job American.,2024-09-28 10:04:53
Spotify,112,208,185,,Often above health positive society.,2024-01-16 23:23:05
Spotify,113,346,4,,Upon with administration sport mother.,2024-02-10 23:41:27
Spotify,114,395,168,,Fish central TV center lay guy hit.,2023-12-12 20:15:33
Spotify,115,221,,16,Very quite consider herself born just mission as.,2024-09-01 22:21:55
Spotify,116,65,152,,Area bad car home it.,2024-01-27 17:43:08
Spotify,117,322,177,,Tree gas idea serious eight top able chair.,2024-09-19 08:40:18
Spotify,118,26,,1,Or likely ready again partner wear site man.,2024-08-21 04:45:08
Spotify,119,196,,3,Serve majority clearly son rise move will yard.,2024-04-28 10:12:01
Spotify,120,262,,11,Thus opportunity billion make every light agree.,2024-01-12 07:14:16
Spotify,121,271,3,,Line season community occur.,2024-03-10 06:57:55
Spotify,122,221,,11,Pay stage do instead.,2024-01-04 15:37:31
Spotify,123,52,,5,Structure call positive exactly.,2024-04-17 04:49:51
Spotify,124,325,44,,Pretty close hotel sign. Hit plant act only.,2024-08-11 03:56:03
Spotify,125,209,,15,Operation season accept source smile.,2024-09-08 13:38:48
Spotify,126,148,65,,When end majority good two if ready.,2024-09-02 02:25:05
Spotify,127,232,,8,Black prove still must student drop.,2024-04-17 04:22:39
Spotify,128,311,,3,Like administration need sing like.,2024-11-15 16:56:41
Spotify,129,319,,14,Inside yourself draw reflect civil.,2024-02-12 02:05:40
Spotify,130,269,119,,Ready view know answer what message.,2024-01-20 16:24:21
Spotify,131,70,,13,If explain reality say believe once.,2023-11-29 11:37:25
Spotify,132,386,52,,Center school decide budget smile public.,2024-02-29 19:30:07
Spotify,133,133,118,,Exactly his between hand laugh bank.,2024-04-15 08:15:36
Spotify,134,230,12,,Politics section important major event above.,2024-11-18 21:20:28
Spotify,135,293,,7,So today decision though.,2024-06-25 05:21:25
Spotify,136,14,,5,Get game appear answer.,2023-12-23 14:35:43
Spotify,137,54,,6,Group player mission class research.,2024-10-27 19:13:21
Spotify,138,387,17,,Hotel even different least. Theory month night.,2024-01-07 12:34:57
Spotify,139,274,196,,Happen billion down American mother experience.,2024-06-22 05:07:53
Spotify,140,212,,3,He mother half save share they.,2024-07-02 04:32:57
Spotify,141,205,119,,Letter may maybe plant.,2024-09-06 22:12:29
Spotify,142,72,,14,Music like wind another.,2024-06-18 04:50:51
Spotify,143,142,157,,Poor practice yes skin want whose door science.,2024-08-15 06:08:57
Spotify,144,260,43,,Manage want art many draw deep.,2024-02-07 08:10:00
Spotify,145,265,18,,College student later exist list by true.,2023-12-18 10:58:17
Spotify,146,256,,16,Mouth season maintain fine.,2024-03-06 15:36:42
Spotify,147,368,32,,Something nice happen check far red situation.,2024-02-28 16:12:09
Spotify,148,207,,4,More service statement free room director top.,2024-02-17 19:29:12
Spotify,149,354,76,,Chance give first Mrs along build.,2024-01-29 16:51:26
Spotify,150,391,136,,Than west cup gun. Management never catch.,2024-03-19 04:45:31
Spotify,151,80,,6,Live keep sea white add mission race.,2024-09-05 12:15:04
Spotify,152,286,,16,Do career tend garden his shake against.,2024-09-09 12:22:36
Spotify,153,151,,18,Between someone color big.,2024-03-04 21:53:22
Spotify,154,238,,9,Include create space agency project any the go.,2024-06-21 10:33:23
Spotify,155,338,,5,Worker evening walk campaign move tree surface.,2024-07-13 06:23:51
Spotify,156,329,,7,No which have treatment eat.,2024-09-23 09:51:42
Spotify,157,391,79,,Language go keep address top son.,2024-11-13 11:15:10
Spotify,158,107,114,,Home lot charge significant.,2024-02-11 00:25:24
Spotify,159,253,,9,Like certain receive care shake very.,2024-07-04 05:03:00
Spotify,160,50,136,,Particularly even particularly.,2024-09-08 11:06:59
Spotify,161,60,,7,Past sense pattern yes ability.,2024-04-11 03:00:55
Spotify,162,387,116,,Machine might cover hour look image let.,2024-07-17 10:59:56
Spotify,163,264,,14,Move fly and.,2024-10-11 02:42:07
Spotify,164,116,,10,Rest read majority current local quite.,2024-10-15 02:35:39
Spotify,165,376,12,,Where Congress improve hold yes bar nature.,2023-12-15 12:41:37
Spotify,166,281,21,,Thousand care plan western visit gun.,2023-12-04 09:45:35
Spotify,167,100,,12,Available how PM citizen.,2024-07-08 21:39:33
Spotify,168,262,134,,Land note authority large.,2024-07-18 08:04:08
Spotify,169,343,,1,Protect today this quality prove.,2024-01-16 08:36:25
Spotify,170,295,19,,Politics perform few true source painting itself.,2024-03-30 22:38:58
Spotify,171,231,,7,Authority child say exist.,2024-02-25 06:07:33
Spotify,172,337,140,,Growth spend fire PM.,2024-04-03 01:37:05
Spotify,173,55,,4,Everyone seat civil quickly show for else and.,2024-01-29 19:22:28
Spotify,174,75,,14,Despite summer check four sometimes apply impact.,2024-09-19 01:55:51
Spotify,175,116,30,,Us authority night city work anything.,2024-06-13 12:12:24
Spotify,176,241,,7,Any Mrs leave these leave future sell.,2024-08-08 18:10:06
Spotify,177,379,,16,It rule set since wrong our however.,2023-11-26 23:36:43
Spotify,178,166,35,,Chance bring early.,2024-03-03 03:17:09
Spotify,179,220,,19,Artist meeting car describe.,2024-04-17 17:13:27
Spotify,180,398,,1,Top wrong fill little weight.,2024-03-25 00:38:07
Spotify,181,15,45,,Only not thousand him suggest suffer change.,2023-11-27 16:07:29
Spotify,182,297,15,,Argue return point technology. With near matter.,2024-02-15 02:26:46
Spotify,183,209,12,,Whole west change but.,2024-09-25 18:58:47
Spotify,184,208,116,,Yet cup budget morning cause.,2024-03-02 16:45:28
Spotify,185,182,,19,Car scene political community.,2024-08-05 12:45:59
Spotify,186,291,181,,Large reality call force concern significant.,2024-10-29 02:30:25
Spotify,187,285,,1,House purpose during thus beat theory.,2024-07-25 14:32:11
Spotify,188,22,,14,Generation reduce line speech.,2024-01-19 16:23:18
Spotify,189,379,161,,Raise in improve form bag practice read least.,2024-03-23 00:31:16
Spotify,190,166,53,,Such look we require eye result.,2024-01-01 16:04:42
Spotify,191,308,135,,Onto like whom own.,2024-01-27 09:00:14
Spotify,192,176,,18,Father wrong enter election.,2024-04-20 10:21:40
Spotify,193,185,186,,Indicate particular per type.,2024-01-21 20:17:04
Spotify,194,344,,10,Something administration I he student.,2024-04-02 02:30:05
Spotify,195,56,37,,Word growth parent option here.,2024-11-17 10:11:41
Spotify,196,339,,2,Land language situation sometimes.,2024-03-30 20:35:59
Spotify,197,380,,4,Rich little modern performance oil protect.,2024-08-05 09:31:42
Spotify,198,379,,12,Skin month service national candidate every.,2024-09-09 03:59:51
Spotify,199,139,90,,Partner phone student note describe.,2024-05-28 15:44:56
Spotify,200,72,131,,Whole own myself form identify fish move.,2024-10-05 17:58:18
Spotify,201,84,129,,Thank miss mean inside practice.,2024-03-17 16:20:17
Spotify,202,330,5,,Sport answer traditional house simple step.,2024-08-20 15:23:51
Spotify,203,260,142,,Natural view stay statement of positive.,2024-08-09 07:08:58
Spotify,204,305,,16,Ahead bank staff put future.,2023-12-09 23:52:10
Spotify,205,78,,7,Our gun fast get other office office.,2024-06-12 20:58:22
Spotify,206,10,155,,Eye change painting recognize tough improve high.,2024-01-12 01:49:31
Spotify,207,208,,15,Interest type available later.,2024-08-17 03:49:16
Spotify,208,329,149,,Force scene film life class.,2024-04-01 05:23:19
Spotify,209,302,,19,Team if south bar point share painting.,2024-10-20 17:07:04
Spotify,210,217,,1,Thank music security ahead.,2024-02-04 22:00:26
Spotify,211,202,64,,Pressure know me people economic well maybe.,2024-08-24 20:01:18
Spotify,212,195,9,,Foot machine arrive school wonder various.,2024-09-09 06:00:36
Spotify,213,235,34,,Others high southern hospital tough return.,2024-04-08 16:28:27
Spotify,214,84,54,,Project sense stock whom bar situation.,2024-06-15 21:15:19
Spotify,215,321,,5,Nothing far recently purpose reach.,2023-12-01 18:02:50
Spotify,216,255,,10,Card kind film great analysis position home.,2024-01-06 16:15:03
Spotify,217,124,86,,Sign policy recognize off mean among.,2024-03-13 16:13:13
Spotify,218,353,90,,Then significant us sense daughter buy.,2024-01-10 16:42:20
Spotify,219,220,,18,Strategy into early another. Top alone practice.,2024-06-23 21:37:23
Spotify,220,151,,8,Worry anything partner size part player training.,2024-10-09 04:24:50
Spotify,221,106,,16,And cultural day less could gas.,2024-08-13 22:28:53
Spotify,222,200,,16,Focus reveal never fact compare my.,2024-01-19 00:07:39
Spotify,223,271,,7,Room campaign condition by morning statement.,2024-08-13 14:23:30
Spotify,224,193,,7,Even start expert itself purpose name city.,2024-10-29 07:27:31
Spotify,225,120,,18,Hair us section central charge event at.,2024-06-06 14:10:13
Spotify,226,238,118,,Understand their pick mind.,2024-09-08 15:21:16
Spotify,227,139,188,,Campaign north energy Congress relate sort none.,2023-12-23 15:41:30
Spotify,228,275,,13,Arrive become public manage available but song.,2024-07-31 18:27:47
Spotify,229,190,122,,Commercial project it play.,2024-01-20 02:39:05
Spotify,230,168,152,,Issue wrong health painting early rule.,2024-01-21 00:32:53
Spotify,231,65,,15,Address watch east voice.,2024-09-09 17:21:47
Spotify,232,46,,4,Lose education unit cut.,2024-06-09 11:36:13
Spotify,233,166,,10,Claim bank American throw church soldier.,2024-05-24 22:39:22
Spotify,234,10,,4,Fine identify Mrs catch point most above while.,2024-09-18 11:51:46
Spotify,235,78,,13,Hand reflect win stop instead perform on.,2024-04-27 05:22:40
Spotify,236,45,8,,Space area throughout visit night enjoy cause.,2024-09-30 18:49:41
Spotify,237,350,138,,Alone safe effort after.,2024-03-22 20:06:25
Spotify,238,101,189,,Cup site human two theory serve bit.,2024-03-21 03:25:19
Spotify,239,157,181,,So rock during stuff year beyond source.,2024-10-12 03:24:17
Spotify,240,251,30,,Goal traditional fear.,2024-01-27 09:00:59
Spotify,241,91,150,,None life something form practice.,2024-03-15 23:03:33
Spotify,242,385,170,,Bar into other forget require join.,2024-01-12 02:15:51
Spotify,243,59,,18,Daughter less response standard.,2024-11-11 03:48:25
Spotify,244,143,,15,Character do meet poor instead discover small.,2024-09-09 05:47:00
Spotify,245,96,,1,By least local involve property wait fall.,2024-11-08 10:33:42
Spotify,246,240,,1,Not or bed possible agent standard.,2024-10-21 05:38:01
Spotify,247,135,,17,Tree add travel memory wrong impact.,2024-03-15 07:13:58
Spotify,248,36,135,,Interview interview bring method.,2024-01-21 05:52:28
Spotify,249,214,,4,End black director through something country.,2024-11-01 05:41:08
Spotify,250,322,128,,Lose record both story. Statement that be some.,2024-03-02 12:56:25
Spotify,251,117,186,,Generation teach ten man.,2024-08-01 09:35:32
Spotify,252,312,134,,Business service or before may worry.,2024-07-22 20:30:25
Spotify,253,286,,16,Actually memory likely can speech it huge score.,2024-04-11 04:17:11
Spotify,254,329,173,,Bring anyone doctor inside them move.,2024-01-08 16:40:46
Spotify,255,257,87,,Unit west plant decide. Customer color lead sing.,2024-02-28 21:08:11
Spotify,256,331,,15,Treat establish majority son east.,2024-06-19 21:45:39
Spotify,257,310,144,,Nor lot key.,2024-01-13 19:52:08
Spotify,258,271,112,,Determine five where upon young.,2024-08-22 22:21:17
Spotify,259,54,,13,Goal interview policy record ever.,2024-07-19 13:21:38
Spotify,260,192,84,,Without authority mother. Against type must.,2024-08-13 00:32:19
Spotify,261,67,,17,Say project risk appear build card brother.,2024-07-17 18:42:38
Spotify,262,237,49,,Election wait tax production.,2024-02-02 15:55:34
Spotify,263,33,,16,Mission course later effect soon yeah discuss.,2024-01-08 07:01:55
Spotify,264,342,69,,Next explain option.,2024-03-23 08:54:08
Spotify,265,18,50,,Economy edge second data civil account discuss.,2024-09-07 22:50:02
Spotify,266,207,1,,Pattern agree Democrat me for western mention.,2024-08-12 22:04:53
Spotify,267,332,125,,Prepare central accept civil.,2024-06-21 06:31:41
Spotify,268,145,159,,Summer garden less consider top.,2024-11-03 01:09:00
Spotify,269,145,77,,Friend meet key on can know top suddenly.,2024-09-14 11:13:54
Spotify,270,119,15,,Who start example important call night.,2024-02-22 06:29:53
Spotify,271,212,74,,Own husband everyone three.,2024-09-13 02:27:10
Spotify,272,149,170,,Dinner will leg culture.,2024-05-10 03:26:04
Spotify,273,193,36,,Anything according back important.,2024-09-29 12:11:29
Spotify,274,245,48,,Amount too factor that issue. During arm drive.,2024-03-24 21:59:00
Spotify,275,329,88,,Southern base health truth size seem man.,2024-10-17 04:04:14
Spotify,276,250,,15,Try approach identify back.,2024-03-24 12:46:38
Spotify,277,346,,1,Trial indeed house money whether step eat.,2024-07-20 17:47:30
Spotify,278,373,41,,Beat feel fund method.,2023-12-10 01:46:08
Spotify,279,283,36,,Ever evening table benefit cold.,2024-05-24 23:35:46
Spotify,280,83,,8,Shake cup tax somebody history believe.,2024-07-05 19:08:59
Spotify,281,232,,11,Present great themselves side including force.,2023-12-28 19:37:44
Spotify,282,78,,18,Specific edge benefit somebody agreement.,2024-04-28 06:40:11
Spotify,283,202,,6,Myself light evidence training all animal hotel.,2023-11-21 07:59:43
Spotify,284,248,,8,Research step leg mind fill maintain certainly.,2024-03-05 05:33:51
Spotify,285,264,108,,Important crime it activity eat when.,2024-08-02 00:08:49
Spotify,286,329,,9,Charge check remember lay somebody.,2024-10-28 13:25:04
Spotify,287,25,,14,Friend enjoy bar everybody trip general wrong.,2023-12-06 19:49:02
Spotify,288,175,,10,Those from cell both.,2024-03-29 19:52:46
Spotify,289,242,70,,Assume know very politics.,2024-08-15 20:05:09
Spotify,290,42,,2,Meeting nothing future perhaps discuss.,2024-07-19 14:09:45
Spotify,291,226,160,,Night majority enter remain.,2024-02-16 21:10:35
Spotify,292,122,156,,Itself account learn item.,2024-04-01 08:03:24
Spotify,293,364,47,,Leg act involve the begin.,2024-10-27 16:29:07
Spotify,294,106,23,,Always change production may authority.,2024-03-27 00:39:12
Spotify,295,237,,16,Save allow trade do animal authority.,2024-07-31 13:15:28
Spotify,296,226,,19,Major health thing coach key.,2024-09-01 16:19:22
Spotify,297,317,,2,Society movie book provide be.,2024-05-15 03:28:40
Spotify,298,58,,12,Four whom doctor director ball owner chair deal.,2024-04-08 05:03:08
Spotify,299,165,,12,Early top none idea.,2024-03-03 11:58:06
Spotify,300,347,,9,Couple statement score adult practice.,2023-11-29 04:38:36
Spotify,301,263,,18,Candidate dark color each court should month.,2024-03-11 03:05:32
Spotify,302,117,169,,Husband law only participant heavy.,2023-12-27 07:45:53
Spotify,303,262,,11,Culture just read summer occur evening.,2024-07-09 20:44:59
Spotify,304,3,,4,Skill goal sing feel.,2024-06-02 15:22:59
Spotify,305,62,181,,Follow both kitchen hit science college voice.,2024-07-06 02:38:22
Spotify,306,312,,1,Three glass sing choose party.,2023-12-22 12:47:27
Spotify,307,352,178,,Trial risk field big enter eat wish worker.,2024-08-23 08:58:07
Spotify,308,274,,12,Next law lay particular out.,2024-06-22 04:13:28
Spotify,309,58,64,,Newspaper cover this cover against.,2024-07-02 10:50:07
Spotify,310,317,,1,Live begin good television whole child.,2024-01-18 20:45:23
Spotify,311,242,,17,Prepare again whole wide.,2024-05-24 13:29:24
Spotify,312,272,,4,Social song never rather several message.,2024-05-11 11:37:42
Spotify,313,73,,15,Crime Mr above by artist many positive college.,2024-06-28 06:57:04
Spotify,314,296,179,,Protect yet city role industry but simply.,2024-02-18 09:37:52
Spotify,315,176,169,,Choice can field name music.,2024-05-10 09:04:44
Spotify,316,385,58,,Operation wall message write pressure language.,2024-01-31 00:38:38
Spotify,317,100,139,,Every effect west significant meet.,2024-09-10 17:57:15
Spotify,318,352,180,,Follow easy role up hot.,2024-08-18 15:04:30
Spotify,319,382,106,,Travel kid save really road arm.,2024-06-08 03:24:55
Spotify,320,55,,8,Executive down than set.,2024-05-25 13:16:37
Spotify,321,168,,11,Newspaper rather method author job letter season.,2024-11-04 10:08:13
Spotify,322,301,,4,Stop everybody investment property school final.,2024-09-27 08:08:38
Spotify,323,306,,6,Four picture career tax process or.,2024-06-24 21:11:42
Spotify,324,212,,15,Book reach at still.,2024-03-26 21:20:18
Spotify,325,257,187,,Military fine after choose home certainly.,2023-12-17 18:42:07
Spotify,326,244,,15,Threat marriage because training garden break.,2024-05-20 11:32:03
Spotify,327,306,152,,Actually lead attack summer score continue.,2024-03-13 04:59:29
Spotify,328,170,43,,Myself trouble road early.,2023-11-30 16:27:09
Spotify,329,54,,11,Always board source size.,2023-12-30 19:15:57
Spotify,330,390,,4,Your through issue administration.,2024-01-02 16:07:34
Spotify,331,367,,6,Very catch crime.,2023-12-15 06:21:09
Spotify,332,293,,5,Allow pattern activity style produce.,2024-04-22 18:25:32
Spotify,333,178,,1,Brother well account first.,2024-03-12 19:14:31
Spotify,334,182,,4,Effort phone necessary class however find.,2024-08-25 06:29:30
Spotify,335,103,,2,Help thing positive.,2023-12-06 02:20:15
Spotify,336,169,,9,Point pretty discuss back sign statement.,2024-02-03 15:18:38
Spotify,337,371,157,,Note today part after soon third quickly stand.,2024-10-12 08:37:26
Spotify,338,277,65,,Minute talk campaign meeting.,2024-04-23 14:16:51
Spotify,339,262,,5,Surface accept really seven final.,2024-06-21 20:12:26
Spotify,340,113,31,,In traditional when inside nation nation.,2024-11-06 16:30:12
Spotify,341,311,,11,Indeed rate experience know expert.,2024-07-31 13:35:17
