provider_id,post_id,user_id,song_id,album_id,description,created_at
Apple,2350,375,11,,Remember green authority affect personal bill.,2024-10-23 03:15:55
Apple,2351,179,76,,Crime price choose ready present.,2024-03-11 01:14:52
Apple,2352,135,21,,Rest almost author particularly rise.,2024-10-07 13:41:06
Apple,2353,3,43,,Study economy finally.,2024-02-16 01:12:44
Apple,2354,165,261,,Why participant partner cost probably.,2023-11-21 11:15:19
Apple,2355,386,,4,Yourself dog beyond their seven owner my.,2024-10-10 11:24:50
Apple,2356,194,,19,Also treat ahead health.,2024-07-20 04:14:19
Apple,2357,255,,9,Guy argue political majority power with.,2024-03-03 03:26:48
Apple,2358,314,,1,Step conference part goal wear black why able.,2024-01-28 02:41:36
Apple,2359,299,,22,Scientist put laugh.,2024-06-01 09:51:30
Apple,2360,295,79,,Smile network just note us.,2024-09-23 21:03:16
Apple,2361,184,275,,Firm enjoy professor company week music.,2024-07-13 02:18:36
Apple,2362,286,,25,Even take drop cause away player much.,2024-02-06 00:48:29
Apple,2363,378,,6,Current concern Congress hear mean skill.,2024-01-13 02:14:09
Apple,2364,361,,24,Contain too professor deep.,2024-01-04 18:27:44
Apple,2365,84,43,,Month figure treat run during.,2024-08-07 08:16:15
Apple,2366,312,,31,Around husband age.,2024-07-01 00:04:33
Apple,2367,281,,22,Impact guess ahead head might bed.,2024-05-16 02:52:40
Apple,2368,22,,31,Voice fill laugh give little.,2024-10-01 10:32:01
Apple,2369,280,14,,Land place exist Congress also tend.,2024-10-24 02:19:40
Apple,2370,14,,26,Other class activity.,2024-10-19 03:45:07
Apple,2371,315,117,,Charge seek and.,2024-05-17 05:13:09
Apple,2372,238,,4,None item others carry.,2024-11-14 07:36:44
Apple,2373,180,,28,Phone collection hear.,2023-12-12 19:34:15
Apple,2374,251,,14,Mrs no mean decide Republican.,2024-10-17 14:02:38
Apple,2375,60,34,,Modern prove within work career.,2024-05-08 04:13:44
Apple,2376,304,,19,Song thank one right. Thing participant too your.,2024-02-27 10:26:36
Apple,2377,354,,22,Seat no data shake test or almost.,2024-07-25 02:15:00
Apple,2378,395,,8,Tax can wife scientist serve.,2024-03-27 20:09:19
Apple,2379,253,257,,Star old job enough happy over south.,2024-02-19 10:22:27
Apple,2380,256,,16,Experience somebody left guy positive arm.,2024-03-21 21:30:47
Apple,2381,281,140,,Game process work newspaper fight.,2024-10-24 09:32:35
Apple,2382,167,20,,Tough writer some eat south.,2024-07-19 11:54:42
Apple,2383,390,118,,Near change nor build stock ball.,2024-09-07 08:32:22
Apple,2384,351,153,,Age administration answer young sound.,2024-06-03 06:21:16
Apple,2385,322,151,,We cost foot physical window go.,2024-08-04 15:42:44
Apple,2386,370,290,,Hotel sign leader hear difficult over real.,2024-03-02 14:02:17
Apple,2387,238,232,,Meet couple collection seek.,2024-06-27 12:37:29
Apple,2388,329,255,,Recently make husband large at number speech buy.,2023-12-27 08:07:41
Apple,2389,205,47,,Summer success whose.,2024-09-04 22:55:01
Apple,2390,220,,9,On network enjoy subject rock become move.,2024-01-25 14:03:08
Apple,2391,10,,22,Guy possible decision stuff.,2024-04-05 00:07:30
Apple,2392,379,,15,Seven own result why sometimes.,2023-12-30 10:07:36
Apple,2393,153,,1,Beat bed movement party media sort.,2023-12-15 17:06:17
Apple,2394,332,,26,Yes sometimes which relate will even carry.,2024-04-24 03:06:52
Apple,2395,263,,7,Truth amount find subject.,2024-06-08 02:19:22
Apple,2396,284,,3,Involve tax senior sit surface sit federal.,2024-09-26 06:59:14
Apple,2397,64,48,,His ball field indeed director.,2023-12-19 19:53:38
Apple,2398,364,,16,Family huge third cold recent mission kind fall.,2024-09-05 01:36:52
Apple,2399,385,,21,Opportunity degree feel leg consumer situation.,2024-07-23 12:51:17
Apple,2400,210,,34,I air hot fast drug society book memory.,2024-03-18 08:12:39
Apple,2401,281,134,,Past form member manage room turn foreign choice.,2024-10-18 06:59:27
Apple,2402,142,,30,End even hospital pull night.,2024-09-17 01:40:26
Apple,2403,89,10,,Crime door defense. Seat country hot sort social.,2024-09-02 07:40:37
Apple,2404,91,147,,Its market truth sometimes movement.,2024-02-28 00:56:38
Apple,2405,251,,28,Make cause anyone might short.,2024-10-19 20:49:46
Apple,2406,340,215,,Meet PM kitchen watch.,2024-05-08 15:20:06
Apple,2407,383,,32,Own common watch former. This take wish job.,2023-12-03 04:22:36
Apple,2408,287,,34,Team former rich artist.,2024-11-11 17:26:40
Apple,2409,282,,18,Foot success both world side structure.,2024-10-17 00:22:49
Apple,2410,373,,20,Player concern rock girl people trouble sport.,2023-12-03 16:02:05
Apple,2411,87,17,,Answer high effect occur improve kid.,2024-02-18 01:06:42
Apple,2412,323,43,,Word surface better wish hotel drug boy.,2024-03-05 10:20:12
Apple,2413,318,140,,Skill house reason red this employee nearly.,2024-01-08 21:34:19
Apple,2414,388,,18,Trial when meeting man none character.,2024-01-09 02:44:50
Apple,2415,78,,3,Painting start act would.,2024-03-10 11:15:12
Apple,2416,118,,7,Pattern all after.,2024-02-09 01:00:51
Apple,2417,387,,1,Money interest glass.,2024-11-09 05:23:28
Apple,2418,41,,27,How point budget wait. Kitchen happy next vote.,2024-07-02 07:56:51
Apple,2419,320,190,,New film task plan glass author head.,2024-03-15 19:30:33
Apple,2420,318,,20,Professional our early sit thank page.,2024-08-19 02:41:50
Apple,2421,115,56,,Two wish space trial rock order.,2024-03-31 18:30:04
Apple,2422,261,,31,Little common share husband safe send.,2024-02-17 13:31:29
Apple,2423,367,,1,Admit field never rule service system ahead.,2024-08-07 21:23:25
Apple,2424,177,12,,Serious operation among.,2023-12-25 23:49:39
Apple,2425,215,,1,Part word industry always agent.,2024-09-11 22:03:07
Apple,2426,231,,18,Response risk admit technology.,2023-12-08 12:01:22
Apple,2427,177,,23,Series official quickly and within.,2024-03-18 14:57:55
Apple,2428,148,211,,Film might maybe determine right nation write.,2024-10-05 00:01:48
Apple,2429,194,61,,Human show establish.,2024-04-26 02:08:28
Apple,2430,125,92,,Nature son lay whole apply fear ball.,2024-04-20 17:39:08
Apple,2431,320,213,,Peace protect ahead movement.,2024-06-14 01:45:05
Apple,2432,267,208,,Particularly final you Mrs benefit.,2024-06-02 13:23:36
Apple,2433,329,64,,Produce these stuff born easy since.,2024-01-09 14:13:24
Apple,2434,390,,32,Religious red program yet clear spend hear need.,2023-12-30 09:30:35
Apple,2435,30,,18,Radio as see wife mind movement father.,2024-03-08 15:44:01
Apple,2436,138,151,,Left sing hour voice mission.,2024-07-28 03:39:14
Apple,2437,329,,33,Live owner worker speech arm chance speech.,2024-07-27 09:01:02
Apple,2438,180,4,,Former positive activity south of great.,2024-01-17 21:20:29
Apple,2439,82,249,,Tv add foot amount style cover.,2023-11-28 07:39:23
Apple,2440,189,56,,Movement way culture half.,2024-06-08 05:11:56
Apple,2441,277,134,,Provide ball something.,2024-10-07 10:50:10
Apple,2442,302,,20,Across figure factor responsibility.,2024-05-25 22:11:43
Apple,2443,177,,14,Physical PM movement some far.,2024-04-07 02:14:27
Apple,2444,229,,10,General try face service after.,2024-07-20 15:56:59
Apple,2445,48,138,,Any myself office provide artist seat some.,2024-08-10 11:09:31
Apple,2446,36,126,,Evening join fill poor. Hope run sign through.,2024-08-16 13:48:46
Apple,2447,317,199,,War design piece most write cover.,2024-02-19 05:06:53
Apple,2448,362,,25,System coach blood amount number behavior.,2024-01-21 03:17:35
Apple,2449,327,,18,Teach citizen end reality land face.,2024-05-25 19:12:16
Apple,2450,45,,4,Art mind natural look note radio these over.,2024-06-14 11:13:52
Apple,2451,305,267,,We share always carry strategy lay.,2024-07-27 16:31:15
Apple,2452,209,,33,Art into series figure reach own.,2023-12-08 17:44:56
Apple,2453,40,,30,Much budget knowledge month well check.,2024-05-01 04:26:23
Apple,2454,248,,31,Material prove more first gas.,2024-05-27 06:27:25
Apple,2455,24,199,,Top fast relationship job later.,2024-01-13 10:59:53
Apple,2456,219,,21,Others tend save life ground seem small.,2024-06-20 17:25:54
Apple,2457,106,95,,They population Mr plan yeah admit.,2023-12-06 15:14:40
Apple,2458,54,,16,Mouth everyone single financial doctor test.,2024-08-06 09:23:15
Apple,2459,35,143,,Instead performance if change right yet learn.,2024-07-26 23:30:07
Apple,2460,23,,24,Happen anything president wind.,2024-02-06 18:46:18
Apple,2461,67,97,,Difference scientist company soon somebody food.,2024-07-04 13:24:53
Apple,2462,64,,23,News deep television growth anyone executive.,2024-09-10 16:19:30
Apple,2463,202,,13,Student out enough business wear energy.,2024-06-10 02:35:31
Apple,2464,262,132,,Ahead hot age approach. School lot future poor.,2024-06-12 11:32:13
Apple,2465,142,,20,Since pressure business daughter prove.,2024-02-24 01:06:40
Apple,2466,178,,11,Sort Mr rock model ready term.,2024-05-22 07:51:27
Apple,2467,382,,23,Smile whole article hotel war ready.,2024-03-30 21:07:55
Apple,2468,333,284,,Institution energy bit it.,2024-02-05 20:22:37
Apple,2469,204,280,,Wear necessary task.,2023-11-25 16:03:11
Apple,2470,139,,30,Her you rock understand chance list ok.,2023-12-01 09:44:30
Apple,2471,127,,23,Professor fire central.,2024-10-26 07:02:09
Apple,2472,114,,1,Move lot guess class.,2024-01-20 00:16:51
Apple,2473,45,209,,Growth week provide individual quickly thing.,2023-12-01 11:56:52
Apple,2474,336,,2,Employee lead one until community.,2024-09-11 12:46:51
Apple,2475,247,25,,Example we left traditional.,2024-09-01 13:21:04
Apple,2476,244,,11,While class will.,2024-01-23 13:20:40
Apple,2477,246,,10,Research against article. Huge you indeed would.,2024-01-24 05:12:19
Apple,2478,76,67,,Level relate foot key top similar effort.,2023-12-24 18:03:38
Apple,2479,35,,23,Service every born nice.,2024-08-09 00:42:14
Apple,2480,44,,30,Move material great campaign.,2024-09-15 19:40:17
Apple,2481,66,280,,Nature coach hit stuff safe.,2023-12-15 05:43:56
Apple,2482,290,142,,Must huge down decade green current interesting.,2024-06-18 23:11:27
Apple,2483,397,176,,Feeling bed eight either one lay each.,2024-08-01 12:49:19
Apple,2484,214,67,,Before condition wonder these this beyond our.,2024-06-06 06:01:50
Apple,2485,288,,26,Song everyone enough page whatever.,2024-02-14 11:41:22
Apple,2486,269,14,,Use president within scene impact seat follow.,2024-01-01 07:47:10
Apple,2487,71,196,,Lose product off bed audience degree.,2024-04-28 20:24:41
Apple,2488,362,242,,Out church top ago place environmental.,2024-08-24 00:52:01
Apple,2489,232,238,,Prevent adult especially I condition.,2024-10-27 00:38:31
Apple,2490,325,,16,Third finally member.,2024-02-17 08:36:03
Apple,2491,77,236,,Hand world when sound art.,2024-03-25 20:53:05
Apple,2492,41,,15,Class name sign others two.,2024-06-26 08:28:40
Apple,2493,374,,10,Doctor stand water seem hand concern.,2024-10-05 08:35:38
Apple,2494,241,111,,Either wind movie generation.,2024-07-22 15:50:12
Apple,2495,39,,16,Station reduce total remember production sort.,2024-03-26 14:15:07
Apple,2496,366,260,,Tonight item major feel bit choose best.,2024-06-24 00:14:33
Apple,2497,174,83,,Western teacher nature whether.,2024-05-25 17:23:24
Apple,2498,372,58,,Although few change environment across.,2023-11-20 10:45:58
Apple,2499,190,242,,Including toward board lead these meeting.,2024-07-08 06:05:39
Apple,2500,397,120,,Stand wide Mr where his.,2024-07-14 20:45:50
Apple,2501,47,,10,Group by citizen lay college collection.,2024-10-25 22:18:39
Apple,2502,161,101,,Let business issue during its.,2024-01-01 19:28:55
Apple,2503,228,,2,Night able send feeling attention.,2023-11-22 17:24:31
Apple,2504,324,165,,Night now bring character.,2024-09-18 08:19:53
Apple,2505,208,,10,Into same social war.,2024-04-16 07:48:42
Apple,2506,57,123,,Civil market animal exist.,2023-12-14 17:13:29
Apple,2507,342,,24,Case never old chance near much present.,2024-02-11 04:42:00
Apple,2508,250,,19,Each Mrs air economic.,2024-11-06 08:30:00
Apple,2509,19,233,,Current anything gas affect move majority.,2024-04-19 16:33:23
Apple,2510,47,58,,Meeting what religious name officer brother in.,2024-01-09 10:00:50
Apple,2511,126,273,,Specific dog lead whole issue resource our.,2024-08-22 06:06:55
Apple,2512,279,78,,Always might raise even skill pretty.,2024-01-25 07:05:14
Apple,2513,155,86,,Main break month.,2024-08-07 11:20:24
Apple,2514,68,233,,Either political at.,2024-07-22 19:10:44
Apple,2515,180,187,,System husband current forget news owner.,2024-11-02 12:49:54
Apple,2516,339,102,,Per example recently represent.,2024-11-12 22:04:04
Apple,2517,264,6,,To imagine natural recently.,2024-04-13 20:56:34
Apple,2518,76,10,,Just page music trade.,2024-02-19 07:55:39
Apple,2519,318,,34,Forward southern anyone spend.,2024-02-20 17:12:52
Apple,2520,310,137,,Painting once or program nice.,2024-05-06 03:49:53
Apple,2521,297,,31,Program think production plant resource.,2024-09-28 12:53:14
Apple,2522,119,,3,Work fish any officer business.,2024-09-25 01:37:27
Apple,2523,331,,2,Social allow medical growth must.,2024-03-10 07:09:15
Apple,2524,71,265,,Former serve letter nothing. Some fear president.,2024-01-29 12:03:52
Apple,2525,384,252,,As specific agree especially upon.,2024-02-22 23:21:26
Apple,2526,195,,22,President book thing blue store.,2024-07-11 06:54:08
Apple,2527,395,244,,Federal girl candidate unit when special reflect.,2024-06-10 20:33:22
Apple,2528,371,,33,Account firm know language lawyer behind pattern.,2024-04-15 06:23:32
Apple,2529,83,,15,Reduce culture good back theory.,2024-06-03 12:30:23
Apple,2530,108,193,,Say set these where people nearly company.,2024-09-06 08:14:47
Apple,2531,10,,1,Along tax us television suffer within play.,2024-10-12 04:51:46
Apple,2532,396,,21,Leader piece chance night officer family.,2024-11-08 15:25:50
Apple,2533,312,200,,Tv dinner of mother market.,2024-03-17 04:51:49
Apple,2534,394,,12,Include idea learn material feel.,2024-04-14 08:53:34
Apple,2535,71,,10,Left finish old inside hair.,2024-07-14 03:36:29
Apple,2536,278,,13,Lead out improve candidate matter happen instead.,2024-04-15 21:23:10
Apple,2537,395,,31,Foreign save better tax executive.,2024-06-11 03:04:42
Apple,2538,374,67,,Win somebody hear involve same miss factor.,2024-04-14 01:05:33
Apple,2539,373,281,,Give forward however sound.,2024-05-18 23:25:04
Apple,2540,184,,19,Care citizen man finish fish investment.,2024-04-23 06:47:36
Apple,2541,198,,15,Decide body machine.,2024-01-27 22:08:08
Apple,2542,190,,4,Fact stage but visit daughter attention.,2023-11-23 03:28:55
Apple,2543,325,238,,Nor too throw onto difficult up thus.,2024-08-19 20:13:09
Apple,2544,244,,20,Seat wish thousand audience ten could.,2023-11-28 07:49:22
Apple,2545,152,,26,Stage from upon method.,2024-06-11 16:14:02
Apple,2546,234,29,,Real four explain someone.,2023-12-11 10:27:17
Apple,2547,297,,6,Not ever bit letter door Congress south.,2024-05-16 23:06:08
Apple,2548,225,,33,Fight he send parent none.,2024-10-13 10:27:04
Apple,2549,369,,27,Only fly society religious.,2024-06-06 20:13:59
Apple,2550,338,,21,Society too quality six system product.,2024-04-28 03:27:21
Apple,2551,41,270,,Suddenly church loss stay leave.,2023-12-12 18:36:32
Apple,2552,355,,29,As option test can single goal ever table.,2024-03-03 08:11:42
Apple,2553,168,,1,Sea trip official country.,2023-12-09 06:46:54
Apple,2554,313,,5,Study dark reveal might.,2024-06-30 12:38:28
Apple,2555,270,251,,Strategy conference mention old father gun.,2024-04-26 19:29:25
Apple,2556,130,,7,Picture pressure drive finish history.,2024-02-15 03:17:14
Apple,2557,181,,23,Middle trade executive throughout such coach.,2024-11-14 13:47:08
Apple,2558,161,72,,Hour indeed energy eight reflect voice much.,2024-09-18 03:07:06
Apple,2559,287,127,,Away arrive seat yeah local.,2024-06-10 11:47:16
Apple,2560,150,151,,Later through such dinner bill remain pass.,2023-12-06 00:03:01
Apple,2561,391,248,,Early see coach.,2024-04-01 06:47:16
Apple,2562,375,,8,Green hope theory newspaper.,2024-03-03 12:51:55
Apple,2563,313,,5,Month imagine actually.,2024-08-27 19:18:41
Apple,2564,239,,2,Performance term happy certain computer.,2024-10-07 12:47:02
Apple,2565,32,61,,Now house point. Central thank suffer employee.,2024-11-05 18:09:21
Apple,2566,53,129,,Whole capital economy size hope who with.,2024-07-18 14:53:04
Apple,2567,363,,8,Past stop officer future figure live.,2024-02-16 04:26:17
Apple,2568,216,,1,Song bit point defense.,2024-07-15 13:02:15
Apple,2569,100,,22,Enter billion resource more say exactly when.,2024-03-14 09:34:08
Apple,2570,168,205,,Safe with movie.,2024-11-03 12:10:30
Apple,2571,30,86,,Environment not wait enough wonder street.,2024-01-18 11:36:07
Apple,2572,259,24,,Arrive today science heavy into money.,2024-03-28 10:02:17
Apple,2573,298,64,,Base as thank certain successful rate wear.,2024-05-09 15:50:48
Apple,2574,185,193,,Current model else onto.,2024-06-12 20:41:17
Apple,2575,233,265,,Rate media edge. Perhaps red method myself after.,2023-12-31 16:39:49
Apple,2576,356,,18,Head letter design seem party. Never fire sell.,2024-06-03 22:53:24
Apple,2577,164,,3,Head media do performance money.,2024-09-23 02:31:00
Apple,2578,51,,5,Past enjoy fine girl her media.,2023-12-23 06:02:10
Apple,2579,30,,34,Move decision prove edge unit heart.,2024-06-28 15:08:14
Apple,2580,56,,31,Call amount new. Remain who allow.,2024-07-25 10:59:36
Apple,2581,340,89,,Home language land position cover another.,2024-05-31 05:58:31
Apple,2582,40,130,,Blue hold care light instead stop few attorney.,2024-09-09 03:39:00
Apple,2583,2,,7,Offer eat church series improve thus.,2024-02-14 12:38:41
Apple,2584,90,166,,Rest fine we. Gas suddenly skill forget.,2024-05-26 09:30:55
Apple,2585,12,,35,Health while need fact guy daughter.,2023-11-20 14:56:43
Apple,2586,196,,20,Before police least wait show hair ball.,2024-02-03 10:40:48
Apple,2587,66,,6,History cause PM.,2024-05-06 17:56:35
Apple,2588,130,286,,Common per effort like country economic.,2024-09-18 17:59:59
Apple,2589,32,161,,Back listen cause ask claim agreement.,2024-08-20 05:06:34
Apple,2590,167,,28,Identify man most through.,2024-09-04 21:42:39
Apple,2591,63,,22,Change open interest build site allow outside.,2024-08-29 08:50:34
Apple,2592,6,,29,Case main than never owner.,2024-06-15 00:32:26
Apple,2593,315,244,,Method first item phone. Eye lose ten thank.,2024-05-02 04:23:08
Apple,2594,64,,4,Plant travel fact game hot.,2024-05-24 01:02:43
Apple,2595,269,,6,Least trade edge break realize lose south care.,2024-04-07 22:03:54
Apple,2596,135,35,,Low certainly blood seat within example.,2024-10-14 00:33:04
Apple,2597,387,,5,Production well south summer main entire answer.,2024-01-25 06:39:34
Apple,2598,231,8,,Specific address hair themselves.,2024-01-06 07:11:59
Apple,2599,86,115,,Test society challenge bank authority.,2024-05-15 13:01:38
Apple,2600,384,,2,Last likely certain standard yourself.,2024-03-06 14:25:08
Apple,2601,391,,24,Statement dog value authority up.,2024-07-12 12:55:30
Apple,2602,85,283,,Government fast loss himself. Always treat I.,2024-04-06 20:54:46
Apple,2603,136,231,,Rather bill technology loss life upon happy.,2024-06-13 06:26:28
Apple,2604,155,,29,How entire operation threat.,2024-02-12 17:54:32
Apple,2605,315,274,,Apply skin Congress letter campaign positive.,2024-07-18 23:28:25
Apple,2606,294,,11,Particular surface price cut on start quality.,2024-10-13 08:20:05
Apple,2607,96,,2,Street military nature hit water girl.,2024-08-23 02:47:27
Apple,2608,378,,8,Sell also arrive dark bill.,2024-04-27 19:03:31
Apple,2609,16,86,,Rise reality better impact.,2024-10-24 11:36:24
Apple,2610,91,198,,Stuff agree bad chance hope buy fear.,2024-05-07 05:57:43
Apple,2611,23,225,,Floor more win hair raise case.,2023-12-07 20:48:54
Apple,2612,55,,1,Training building keep professional to room.,2024-01-18 13:47:43
Apple,2613,226,,27,Probably PM address nearly certain laugh summer.,2024-07-20 03:16:28
Apple,2614,303,173,,Resource able president. Focus raise floor occur.,2024-07-28 09:10:30
Apple,2615,157,264,,Occur knowledge even have general project spring.,2024-09-23 10:57:05
Apple,2616,217,,13,Behind affect arm house.,2024-02-16 13:40:40
Apple,2617,75,,9,Letter light sea offer join since four.,2024-09-04 15:55:27
Apple,2618,206,43,,Maybe full usually expert yet stage.,2024-05-31 09:19:32
Apple,2619,93,132,,Include war later bit forget determine.,2024-03-15 12:58:19
Apple,2620,108,265,,Anyone although enough.,2024-05-04 07:16:28
Apple,2621,85,200,,Sell nation certainly.,2024-09-10 22:48:55
Apple,2622,106,146,,Shake clear community capital job state.,2024-11-05 07:24:03
Apple,2623,129,11,,Next start land institution issue reason.,2024-11-05 17:39:43
Apple,2624,307,118,,Seem behavior middle road name believe.,2024-10-23 06:55:04
Apple,2625,78,,11,Town development cause. Indeed receive stock.,2024-08-03 02:39:45
Apple,2626,348,,28,Own majority challenge born.,2024-02-29 11:59:05
Apple,2627,304,96,,Audience my plan.,2024-08-16 09:39:09
Apple,2628,87,,11,Or if away his million attention.,2024-08-14 12:55:50
Apple,2629,397,,5,Apply land theory staff side beyond sea note.,2024-04-14 20:13:04
Apple,2630,96,217,,Be plan individual beat.,2024-06-06 00:58:43
Apple,2631,227,174,,Be any executive throw seven share.,2024-08-07 08:59:40
Apple,2632,141,,1,Be avoid best. Drop opportunity wall very else.,2024-06-21 07:55:29
Apple,2633,373,63,,Join three once probably night trial.,2024-11-07 12:49:07
Apple,2634,116,,18,Program heart once science.,2024-03-16 04:47:00
Apple,2635,400,63,,Choice attorney indicate break.,2024-01-25 15:33:58
Apple,2636,393,,28,Church next story memory reason what east.,2024-01-04 15:19:54
Apple,2637,134,168,,Year off economic child.,2024-08-18 10:29:17
Apple,2638,343,,15,Bring be only magazine opportunity professor.,2024-10-02 14:35:13
Apple,2639,213,,2,Nation second occur throughout force sign.,2024-01-23 12:18:01
Apple,2640,79,184,,Cup new century sound.,2024-08-21 15:21:55
Apple,2641,360,172,,Station ten return last its visit worker.,2024-06-24 11:50:05
Apple,2642,330,,17,Else just tax which impact.,2024-07-09 20:55:06
Apple,2643,269,70,,Cultural not decade.,2024-06-03 18:12:07
Apple,2644,365,,12,Huge four live. Song scientist available.,2024-01-28 05:00:08
Apple,2645,152,,17,Tree interest speech me site unit.,2024-05-05 01:02:28
Apple,2646,275,,6,Answer piece reason without herself door fight.,2024-05-05 18:38:52
Apple,2647,354,,3,Baby another light common.,2024-11-12 13:58:20
Apple,2648,66,,26,Camera concern front continue necessary.,2024-09-02 10:58:50
Apple,2649,372,,10,Do case tell paper.,2024-08-03 14:43:27
Apple,2650,110,,23,Body indeed your four second.,2024-10-12 23:45:53
Apple,2651,347,290,,Medical must lot himself ready.,2024-06-26 10:52:57
Apple,2652,362,,25,Buy hospital ever movement inside something easy.,2024-10-13 17:03:22
Apple,2653,232,185,,Road away either friend may family admit.,2024-09-06 19:05:15
Apple,2654,108,34,,Green give determine big.,2024-05-29 07:06:40
Apple,2655,231,,15,Blood number on throw necessary your offer white.,2024-08-29 10:58:04
Apple,2656,232,,33,Change talk room.,2024-08-11 19:24:07
Apple,2657,246,,18,Staff position exist kid probably blue.,2023-12-11 20:38:30
Apple,2658,12,,14,Add third field magazine since project here.,2023-12-27 10:45:57
Apple,2659,384,,27,Grow about stuff. Claim vote wide dark end who.,2024-06-20 03:53:56
Apple,2660,58,249,,International center car Democrat owner.,2024-11-11 22:24:57
Apple,2661,371,,7,Edge manager effort fact event pattern level.,2024-01-21 18:12:41
Apple,2662,289,,19,Herself police paper light.,2024-01-01 04:18:32
Apple,2663,360,265,,Visit perhaps attorney.,2024-01-31 21:30:43
Apple,2664,212,89,,Pass cause summer truth trade.,2024-06-14 04:06:52
Apple,2665,23,45,,Morning weight yeah. Fund keep seat.,2024-04-04 13:49:24
Apple,2666,55,,6,Notice realize employee explain former indeed.,2024-01-12 06:43:05
Apple,2667,271,,9,Method right across gas democratic.,2024-04-09 15:53:57
Apple,2668,226,,14,Computer him throw coach by because.,2024-04-15 11:13:28
Apple,2669,340,,27,Yeah cover professional else society call.,2024-02-22 15:26:24
Apple,2670,94,224,,Recognize mind involve find.,2024-07-06 14:04:21
Apple,2671,128,,20,Wear particular involve sing whose head child.,2024-06-29 17:58:25
Apple,2672,126,34,,Reach campaign conference finally.,2024-01-28 07:36:01
Apple,2673,164,,28,Church stand catch here wide daughter rich.,2024-10-01 08:16:17
Apple,2674,16,,34,Every material whether newspaper make.,2024-06-22 06:48:02
Apple,2675,158,75,,Debate most anyone trial recognize face.,2024-08-07 08:44:52
Apple,2676,222,,30,Staff several born half eye.,2024-03-26 02:54:02
Apple,2677,346,,24,Thought available evidence these north.,2023-12-16 10:36:38
Apple,2678,348,,8,Call give single morning.,2024-02-03 21:23:34
Apple,2679,346,,4,Training information no indeed part around.,2024-09-02 12:17:58
Apple,2680,239,49,,Inside child page number.,2024-03-30 01:25:24
Apple,2681,112,113,,A democratic follow.,2024-06-21 17:16:18
Apple,2682,291,,25,Side sure among onto yard over.,2024-08-08 14:29:32
Apple,2683,19,,23,Structure tax wonder.,2024-01-06 20:01:05
Apple,2684,31,,17,Section box form itself old.,2024-01-04 05:59:06
Apple,2685,271,,21,Sense save off.,2024-10-11 04:21:52
Apple,2686,85,208,,Third hit mission full write meeting.,2024-05-01 22:02:25
Apple,2687,23,139,,Arrive its Democrat ten religious trade.,2024-05-12 14:33:30
Apple,2688,193,49,,Young safe risk billion free.,2024-05-18 21:02:18
Apple,2689,309,,26,Have day condition law board notice.,2024-07-14 15:42:27
Apple,2690,176,,23,Serve area although before find analysis oil.,2024-08-18 19:03:42
Apple,2691,233,71,,Central nothing pick voice other another can.,2023-11-30 23:23:16
Apple,2692,75,,33,Under remember movie tonight.,2024-06-13 05:55:49
Apple,2693,90,52,,Sea degree after like.,2024-06-21 13:54:27
Apple,2694,318,38,,Happen defense standard town firm.,2024-06-21 03:18:18
Apple,2695,339,,32,Run air well tree expert ready.,2024-07-01 05:24:18
