provider_id,post_id,user_id,song_id,album_id,description,created_at
Spotify,2371,178,138,,His new manage personal care.,2024-07-08 20:59:30
Spotify,2372,385,,15,Science article system accept.,2024-05-03 03:04:49
Spotify,2373,215,31,,Government modern season.,2023-12-16 23:36:16
Spotify,2374,242,157,,Away million piece.,2024-03-07 14:07:30
Spotify,2375,197,,18,Talk record require or full age seven.,2024-08-06 20:24:32
Spotify,2376,42,41,,Those look record note.,2024-02-20 20:53:54
Spotify,2377,165,,8,Page purpose right tax operation form technology.,2024-04-14 18:03:46
Spotify,2378,106,,4,Recently hot budget loss collection bed.,2024-04-15 19:01:45
Spotify,2379,44,156,,Current democratic politics establish.,2024-02-05 05:29:24
Spotify,2380,114,,2,Into provide according per degree raise.,2023-12-22 07:07:03
Spotify,2381,257,,13,Time left her prevent.,2023-11-29 04:06:35
Spotify,2382,365,126,,Opportunity organization those fill brother hand.,2023-12-17 15:18:20
Spotify,2383,385,,12,Society including whom police serve.,2024-01-03 07:21:21
Spotify,2384,171,123,,Religious role old there glass hotel.,2023-11-23 17:11:04
Spotify,2385,63,,4,Charge that effect affect foot throughout.,2024-05-03 07:20:57
Spotify,2386,206,,11,Purpose road second able someone scientist race.,2024-01-10 10:13:23
Spotify,2387,166,,15,Whom star anyone treat leader event eye.,2024-04-11 14:51:06
Spotify,2388,335,,12,Manager store American involve.,2024-06-27 11:34:02
Spotify,2389,299,90,,Decision every worry identify indeed assume.,2024-07-02 00:03:31
Spotify,2390,340,141,,Year network national. Buy them age clearly.,2024-03-08 03:06:44
Spotify,2391,328,,14,Call against general.,2024-08-03 17:16:06
Spotify,2392,111,,13,Usually be road type include recent.,2023-11-21 22:20:47
Spotify,2393,177,,13,Money role that improve final heavy past.,2024-03-15 21:19:11
Spotify,2394,147,,19,A so remain compare human wall.,2024-05-03 03:27:35
Spotify,2395,369,,2,Agency project number.,2024-01-06 19:33:16
Spotify,2396,203,117,,Coach religious institution billion let.,2024-07-26 03:30:51
Spotify,2397,117,135,,Rather girl try myself.,2024-02-15 20:33:31
Spotify,2398,333,8,,Fill customer race attack success focus heart.,2024-01-12 17:26:09
Spotify,2399,213,167,,Above news all individual sometimes must.,2024-06-12 11:44:50
Spotify,2400,20,,2,News rather example no.,2024-02-16 19:18:05
Spotify,2401,33,142,,Wide writer decision someone PM.,2024-08-20 03:18:08
Spotify,2402,22,47,,Country senior second strategy site.,2024-08-31 08:31:52
Spotify,2403,74,92,,Table talk they stand. Remain appear light her.,2024-08-27 07:00:27
Spotify,2404,334,,3,Different adult enter think provide.,2024-01-07 01:38:17
Spotify,2405,176,,16,Act training others however rich arm.,2024-08-27 21:38:57
Spotify,2406,169,,18,Respond any put. Yes write who per.,2024-05-09 02:03:18
Spotify,2407,283,23,,Campaign beyond factor dog positive.,2024-07-16 01:38:16
Spotify,2408,346,,2,Suggest on race between dog. Week I vote charge.,2024-07-10 02:26:39
Spotify,2409,391,,14,Standard fill vote thousand in how.,2023-12-06 22:21:01
Spotify,2410,79,147,,Range thousand author hard.,2024-08-07 07:34:23
Spotify,2411,96,,19,Yourself summer book.,2024-11-17 10:06:00
Spotify,2412,174,46,,Industry according end simple feel.,2024-05-10 20:19:40
Spotify,2413,311,,19,Government minute miss only action section.,2024-01-13 18:22:44
Spotify,2414,400,,19,Culture argue century decide matter management.,2024-06-21 11:49:53
Spotify,2415,62,,14,My but official opportunity certain book floor.,2024-06-06 04:38:26
Spotify,2416,243,155,,Why until tend everything itself pick.,2024-01-24 17:22:37
Spotify,2417,27,38,,Result such serious themselves include debate.,2024-01-25 02:22:55
Spotify,2418,345,163,,Goal cut product rise.,2024-09-11 06:47:39
Spotify,2419,31,,4,Born quickly bag.,2024-01-15 21:53:14
Spotify,2420,399,22,,Kid help possible feel place.,2024-01-21 16:57:20
Spotify,2421,299,,4,Design eat shoulder eight.,2024-03-27 12:30:53
Spotify,2422,328,56,,Republican any left the bank.,2024-10-03 10:35:28
Spotify,2423,43,,7,Me who first year growth.,2024-01-08 03:59:16
Spotify,2424,190,194,,Official cell control PM begin public still unit.,2024-03-03 22:38:01
Spotify,2425,215,,13,Machine deep meet eye today box.,2024-08-17 02:34:44
Spotify,2426,90,,1,Over later those writer.,2024-09-09 10:35:13
Spotify,2427,149,150,,Turn participant question near life create.,2024-11-05 13:03:48
Spotify,2428,228,1,,Particularly fact tend second low.,2024-06-22 11:38:05
Spotify,2429,245,160,,Step adult issue mother quite.,2024-05-05 12:10:48
Spotify,2430,9,14,,Trial expect low kitchen.,2024-08-02 03:49:30
Spotify,2431,147,,13,Still organization rather mission.,2024-11-19 01:47:13
Spotify,2432,184,,5,Community effort alone main down light.,2024-06-12 08:48:41
Spotify,2433,42,59,,Impact Mrs church building.,2024-05-25 04:34:34
Spotify,2434,122,,8,Artist maintain page market.,2024-01-12 15:04:26
Spotify,2435,76,,11,There too reality value direction better matter.,2023-12-03 09:03:45
Spotify,2436,367,,3,Every small someone discussion enjoy.,2024-10-25 09:00:31
Spotify,2437,237,44,,Police son true dark. Follow whose three send.,2024-06-12 15:10:51
Spotify,2438,68,,18,Former site miss while guy toward serve.,2023-11-30 02:25:15
Spotify,2439,284,,10,So might beautiful box rule dark her.,2024-06-09 21:34:31
Spotify,2440,179,,7,Television art customer program party.,2024-07-26 12:15:25
Spotify,2441,11,,1,Protect over represent century too.,2024-10-13 09:37:05
Spotify,2442,88,124,,Kid care how bar notice interesting.,2023-11-28 04:19:31
Spotify,2443,2,144,,On money add difficult four least story.,2024-06-12 17:59:25
Spotify,2444,303,,6,Out say ahead hundred analysis wonder provide.,2024-03-13 10:52:33
Spotify,2445,126,,5,Serious ahead professional fall.,2024-04-09 21:54:23
Spotify,2446,393,138,,Place son enjoy explain.,2024-11-02 10:07:58
Spotify,2447,231,127,,Loss commercial teacher main.,2024-05-16 10:48:36
Spotify,2448,217,,10,Thus half home build.,2024-01-23 23:53:40
Spotify,2449,313,,17,Reflect mouth window her what.,2024-08-30 16:06:47
Spotify,2450,370,20,,However strong would share reveal land skin.,2024-06-18 04:13:03
Spotify,2451,177,17,,More someone size to us clear.,2024-09-27 19:30:35
Spotify,2452,263,,16,Goal government mean never.,2024-01-16 19:55:09
Spotify,2453,156,55,,Fact institution call focus notice really that.,2024-11-02 16:15:01
Spotify,2454,57,,5,Model guess serve after.,2024-01-16 17:49:15
Spotify,2455,31,140,,Enter significant weight forward itself call.,2024-04-26 22:24:30
Spotify,2456,124,40,,Both price increase. Skill out idea they.,2023-12-09 23:56:44
Spotify,2457,81,40,,Guess all fund oil pattern.,2024-01-25 00:21:55
Spotify,2458,57,150,,Sure prove hear from make catch.,2024-06-19 00:47:00
Spotify,2459,331,81,,Able me interesting different whole indeed.,2024-04-07 15:17:50
Spotify,2460,241,,18,Health medical too air school.,2024-01-07 21:21:18
Spotify,2461,26,,15,Wear stage work movement.,2023-12-05 22:56:11
Spotify,2462,155,,10,Land decide affect despite writer raise.,2024-06-08 17:00:31
Spotify,2463,147,68,,Form myself strong majority myself.,2024-10-08 11:02:12
Spotify,2464,320,51,,About with official power avoid life grow course.,2024-08-14 19:59:24
Spotify,2465,344,,3,Avoid whom between its well carry ok agency.,2024-08-01 11:03:05
Spotify,2466,250,147,,Task shoulder accept something first rule.,2024-06-13 21:38:36
Spotify,2467,391,,11,Hundred often growth usually clear us small.,2024-10-20 18:36:06
Spotify,2468,345,,18,Room staff read sort support.,2024-09-02 02:58:01
Spotify,2469,101,105,,Project call mention follow evidence.,2024-06-28 09:32:23
Spotify,2470,150,190,,Simple them remember couple them.,2024-08-19 23:49:53
Spotify,2471,113,97,,Cell economy democratic tax million send.,2024-10-09 01:51:13
Spotify,2472,359,135,,Brother word nice memory want himself blood then.,2024-09-21 14:21:55
Spotify,2473,261,,2,Worker character forward despite operation.,2024-11-06 10:24:07
Spotify,2474,146,,7,Figure official drive whose.,2024-03-05 09:27:04
Spotify,2475,207,85,,Public create cause bank fire performance.,2024-08-25 18:49:37
Spotify,2476,141,106,,Morning improve most again top.,2024-01-08 05:16:55
Spotify,2477,229,187,,Decide you economic score trial over.,2024-07-15 00:26:50
Spotify,2478,308,,6,Far visit these final great.,2024-01-22 23:23:51
Spotify,2479,6,,12,Region notice watch crime management case.,2024-02-10 19:17:33
Spotify,2480,134,6,,Kid employee then store.,2024-01-11 07:29:54
Spotify,2481,188,96,,Agency American in magazine to.,2024-10-19 14:47:52
Spotify,2482,129,,1,Use thought sea less rate if business.,2024-06-26 07:37:57
Spotify,2483,227,70,,Chair wide back yourself rather company.,2024-09-27 03:30:07
Spotify,2484,358,145,,Apply imagine true finish treat task.,2024-05-19 15:08:03
Spotify,2485,4,142,,Hard story source realize player group use road.,2024-03-19 21:14:25
Spotify,2486,162,,2,Sister white rich.,2024-10-09 13:16:19
Spotify,2487,115,191,,Which direction enter strong see not wall.,2024-03-08 07:46:45
Spotify,2488,257,,12,Start seek anything probably what create for.,2024-03-13 23:03:05
Spotify,2489,240,23,,Decade prevent position discussion.,2023-12-23 19:26:25
Spotify,2490,278,,3,Box specific require left account may goal.,2024-08-29 01:50:53
Spotify,2491,383,94,,Or yet decide.,2024-05-25 13:06:17
Spotify,2492,207,67,,Decide receive buy.,2024-04-21 12:10:56
Spotify,2493,57,147,,Sort write guess glass truth stage miss.,2024-07-01 02:11:00
Spotify,2494,134,,15,Environment energy team people our rich.,2024-06-20 20:11:53
Spotify,2495,244,160,,Event improve some material part parent local.,2024-04-25 15:41:02
Spotify,2496,264,,12,Quite he indeed travel.,2024-11-12 19:58:42
Spotify,2497,383,,7,Expert tough way soldier.,2024-09-15 00:29:44
Spotify,2498,303,,11,Every fill magazine parent those capital.,2024-03-26 12:31:05
Spotify,2499,170,,5,A may news maybe thought professional act.,2023-12-13 15:16:01
Spotify,2500,262,,16,Land from grow level car compare film.,2024-01-16 22:14:26
Spotify,2501,92,,16,Benefit process doctor national team father.,2024-01-15 23:12:10
Spotify,2502,107,,15,When share star institution.,2024-10-17 14:32:30
Spotify,2503,296,,15,Lead pick why skin drop since drive.,2024-08-03 12:26:13
Spotify,2504,395,98,,Today management commercial story.,2024-10-15 18:29:05
Spotify,2505,174,,11,Coach not condition study.,2024-03-25 16:21:31
Spotify,2506,90,,2,Can national line defense line.,2024-10-18 04:29:15
Spotify,2507,319,73,,Character then above cup.,2024-08-29 19:36:52
Spotify,2508,16,136,,Owner likely citizen hard teacher check physical.,2024-06-20 02:00:14
Spotify,2509,177,120,,However stage trouble.,2024-03-27 04:19:08
Spotify,2510,362,110,,Trial power degree relationship.,2023-12-25 20:33:27
Spotify,2511,130,22,,Race build use sport home decide.,2024-02-16 22:10:07
Spotify,2512,107,141,,Personal prepare policy.,2024-09-09 23:46:29
Spotify,2513,176,,1,Hold full party financial hundred society coach.,2024-11-12 15:41:48
Spotify,2514,333,,8,Quickly care too city will tough science.,2024-05-14 10:07:51
Spotify,2515,240,,12,Card set tell exactly throw question.,2024-04-12 17:42:09
Spotify,2516,388,,1,Improve anything community establish.,2024-01-01 06:52:12
Spotify,2517,336,59,,Member hundred pass everybody project.,2023-12-13 11:59:55
Spotify,2518,86,189,,Hot take interesting.,2023-12-18 08:57:55
Spotify,2519,255,132,,Statement win local argue article response bad.,2024-06-10 16:00:06
Spotify,2520,299,110,,Hair improve follow market challenge employee.,2023-12-13 23:51:43
Spotify,2521,391,142,,Easy anything PM sister see. Establish rule cut.,2024-07-25 08:02:56
Spotify,2522,227,97,,Analysis animal what second might.,2024-01-10 13:29:29
Spotify,2523,238,12,,Picture step tree. Newspaper food support.,2024-11-15 04:44:51
Spotify,2524,299,94,,Mr at sister development and remember forward.,2024-01-31 06:48:03
Spotify,2525,71,,12,Yard play leader leg million though hour.,2024-05-03 05:52:24
Spotify,2526,161,45,,Ten either human discuss word service scientist.,2024-01-24 17:20:21
Spotify,2527,71,168,,Special manage agent.,2023-12-26 15:07:44
Spotify,2528,359,,10,Allow child power seem too several each.,2024-04-29 08:08:06
Spotify,2529,2,80,,Attack art sister customer manage.,2024-01-08 06:09:33
Spotify,2530,153,,10,Rich your deep action foreign.,2024-08-16 17:51:04
Spotify,2531,99,,8,Sea fund back tend.,2024-08-01 23:51:20
Spotify,2532,357,127,,Reach where step close step sing current.,2024-09-17 07:32:37
Spotify,2533,120,40,,Evening during top trade price.,2023-11-27 19:24:23
Spotify,2534,21,,11,Per wind expert student view body.,2024-02-08 05:09:51
Spotify,2535,246,84,,Whether store challenge task recognize.,2024-07-28 19:10:51
Spotify,2536,32,,11,Even work require teach economic.,2023-12-14 04:08:08
Spotify,2537,145,,17,Believe other shoulder.,2024-08-11 00:30:30
Spotify,2538,26,,14,Stop full plant behind management factor.,2024-08-24 07:32:13
Spotify,2539,252,47,,House return full money agency happen.,2024-10-11 17:07:27
Spotify,2540,175,,13,Discuss relate simple bit fall.,2024-10-03 03:46:55
Spotify,2541,301,144,,Age social without speak half sort look.,2024-08-06 17:03:45
Spotify,2542,257,,4,Describe social everything.,2024-11-05 02:46:00
Spotify,2543,394,40,,Ever federal whose property.,2024-10-20 13:13:20
Spotify,2544,69,,6,Though her short hot think stage democratic.,2024-08-20 04:44:05
Spotify,2545,381,,16,Property meeting hit prove magazine fish.,2024-01-14 22:22:58
Spotify,2546,104,133,,Strong place officer future mind.,2024-05-03 15:17:01
Spotify,2547,274,122,,Avoid return draw scene. Impact occur about want.,2024-06-30 13:39:53
Spotify,2548,19,,16,Work quality sell huge already.,2024-01-15 04:06:21
Spotify,2549,224,194,,Argue leave nor hope recognize national war.,2024-08-15 12:46:01
Spotify,2550,265,,4,Method paper option or create discussion network.,2024-08-03 15:40:20
Spotify,2551,344,104,,Republican money language leave.,2024-03-17 07:39:29
Spotify,2552,276,61,,Record owner not skin.,2024-05-15 05:07:56
Spotify,2553,236,,18,Car start why site wall leader skin.,2023-12-25 05:57:07
Spotify,2554,112,78,,Our table sometimes president class only think.,2024-05-21 08:34:11
Spotify,2555,199,,13,Mention better detail movie.,2024-10-15 16:21:45
Spotify,2556,123,33,,Nothing behavior he ready half.,2024-03-23 15:10:18
Spotify,2557,284,113,,Pay law wonder capital page.,2024-02-10 13:18:00
Spotify,2558,175,111,,Through population position since property hit.,2024-03-08 09:38:56
Spotify,2559,70,,7,One stop election leave tax.,2024-02-18 10:48:23
Spotify,2560,261,119,,Add huge discuss political picture.,2024-02-15 14:25:13
Spotify,2561,156,86,,Pass role white glass state.,2024-02-18 00:08:13
Spotify,2562,376,47,,Appear animal statement.,2024-08-29 14:42:29
Spotify,2563,220,,2,Agree method region down military.,2024-03-11 20:23:59
Spotify,2564,158,,11,Idea which always anything anything cover.,2024-01-11 19:28:38
Spotify,2565,294,110,,Third magazine ask when chair Democrat.,2024-03-29 15:11:46
Spotify,2566,143,,11,Age address listen development.,2024-06-20 20:12:56
Spotify,2567,33,,8,Pretty by politics. Keep ask southern power note.,2024-09-24 00:21:07
Spotify,2568,198,,2,Place community wish.,2024-05-20 16:47:08
Spotify,2569,335,57,,Simply enter way because like people back plan.,2024-07-14 11:07:03
Spotify,2570,305,,15,City task mean training smile least computer law.,2024-03-02 19:19:34
Spotify,2571,130,,10,Go will low travel eight same course.,2024-08-14 22:15:45
Spotify,2572,30,185,,Yet treat radio window.,2024-04-20 14:18:17
Spotify,2573,371,,6,Large suffer project reduce.,2024-11-03 14:44:04
Spotify,2574,151,31,,Just morning speech everyone wear war.,2024-10-18 07:52:20
Spotify,2575,368,9,,Heavy tend worry though book.,2024-04-06 12:54:58
Spotify,2576,196,,5,Shake participant thus from effort.,2024-09-17 08:25:11
Spotify,2577,242,,1,Without adult under how night court baby.,2024-05-12 02:59:49
Spotify,2578,392,193,,Safe home quality space research owner surface.,2024-08-22 04:36:44
Spotify,2579,320,,5,Save run front see management character policy.,2023-11-29 23:53:24
Spotify,2580,266,,19,Feel spring soon.,2024-06-02 04:35:22
Spotify,2581,157,,11,Above somebody upon message them say left sort.,2024-02-10 08:26:29
Spotify,2582,169,,7,Stay region military course while.,2024-01-06 04:27:55
Spotify,2583,51,,8,Produce soon sign policy say.,2024-06-14 12:38:41
Spotify,2584,68,58,,Money store support increase she.,2024-08-21 18:38:38
Spotify,2585,401,,7,Manager suffer success will present.,2024-10-19 00:41:53
Spotify,2586,333,,4,Reason available key simply near establish.,2023-12-09 20:48:47
Spotify,2587,171,,8,Yourself score PM low property camera individual.,2024-03-10 21:27:09
Spotify,2588,219,,18,Stand visit wish garden knowledge truth.,2024-08-22 02:46:59
Spotify,2589,309,179,,Act which catch kind.,2024-10-23 05:54:07
Spotify,2590,195,,18,Respond leader meeting meeting.,2024-11-11 20:15:00
Spotify,2591,57,196,,Special cover organization professional yourself.,2024-02-13 06:25:55
Spotify,2592,375,,10,Together anyone include heavy believe foot small.,2024-04-08 05:46:14
Spotify,2593,383,132,,Level near prevent night.,2024-05-25 08:27:37
Spotify,2594,172,,15,General book enough produce nothing office.,2024-01-12 07:24:31
Spotify,2595,175,138,,Right evidence magazine century.,2024-09-30 08:30:22
Spotify,2596,139,,11,Tend close if range.,2024-07-07 00:55:07
Spotify,2597,192,,14,Much look field realize situation compare ago.,2024-11-17 17:35:12
Spotify,2598,319,114,,Six understand bring brother medical your.,2024-01-18 03:31:27
Spotify,2599,170,11,,Seem do by head college.,2024-04-23 11:56:21
Spotify,2600,79,85,,Production least tend close.,2024-02-29 21:35:07
Spotify,2601,235,94,,Close relationship daughter lawyer age.,2024-07-17 16:32:40
Spotify,2602,213,183,,Involve it quite.,2024-11-13 03:45:13
Spotify,2603,279,100,,Particular age lot see personal head simply.,2024-11-02 17:38:01
Spotify,2604,385,,9,Or only off instead. Feel well purpose.,2023-12-15 21:16:38
Spotify,2605,360,,13,To especially among reality.,2023-12-05 00:49:39
Spotify,2606,133,,17,Thus hope exist team thank hospital hair impact.,2023-12-02 13:18:16
Spotify,2607,302,11,,Something so early down leader political.,2024-08-05 03:25:45
Spotify,2608,111,39,,Involve many everyone after for.,2024-04-21 19:32:44
Spotify,2609,145,,6,Floor activity tree ball.,2024-09-11 08:47:17
Spotify,2610,39,,15,Subject trip hand evidence.,2024-07-07 23:26:45
Spotify,2611,298,71,,Fill attorney meeting world.,2024-10-22 15:47:10
Spotify,2612,241,111,,Director business property do wait.,2024-06-04 00:21:59
Spotify,2613,261,,17,Republican military under significant.,2024-04-09 04:39:07
Spotify,2614,107,189,,Whether represent long where million.,2024-03-15 04:54:29
Spotify,2615,364,160,,Fast long lawyer.,2024-09-06 19:22:42
Spotify,2616,6,,2,Anything me hour finish level.,2024-05-21 23:54:34
Spotify,2617,352,,15,Keep lay any again serious owner.,2024-06-24 08:16:58
Spotify,2618,133,142,,Year performance some indicate.,2024-04-11 12:26:47
Spotify,2619,397,,3,Significant form hold point reach goal accept.,2024-10-22 07:08:35
Spotify,2620,265,164,,Important interest sit Democrat wrong few.,2024-03-10 13:40:43
Spotify,2621,297,100,,He fall court action. Within somebody usually.,2024-06-24 20:01:05
Spotify,2622,71,,17,My way side husband start.,2024-09-18 16:47:18
Spotify,2623,341,156,,Next over color green open condition keep.,2024-07-15 06:58:03
Spotify,2624,312,,18,Deep young teach authority.,2024-09-04 00:30:41
Spotify,2625,108,,11,Personal education second television.,2024-06-05 20:00:26
Spotify,2626,246,,11,Those hard attention social act position.,2024-02-04 05:30:17
Spotify,2627,256,,5,Woman measure do ahead. Fly protect whole of.,2023-11-24 18:12:27
Spotify,2628,167,,5,Much allow prove court campaign cell.,2024-05-31 11:11:09
Spotify,2629,147,167,,Why while identify pay someone almost.,2024-10-18 14:14:36
Spotify,2630,210,,16,Smile anything history fight TV.,2024-05-23 08:34:22
Spotify,2631,375,75,,West before skin. Wall Mr eat to blue same.,2024-06-16 22:35:44
Spotify,2632,114,,14,Various clearly science seek total first forward.,2023-12-14 14:32:14
Spotify,2633,230,,12,Class operation decide store of.,2024-09-19 19:00:28
Spotify,2634,124,,12,Color my site time resource not career.,2024-08-28 14:04:52
Spotify,2635,304,84,,Large yeah determine field lead office.,2024-03-06 03:46:49
Spotify,2636,61,48,,Enough bag identify woman style its.,2024-07-13 21:47:13
Spotify,2637,210,128,,Interview trouble general add street third hard.,2024-04-02 14:28:19
Spotify,2638,87,5,,Seek social business herself.,2024-03-25 15:22:53
Spotify,2639,401,,15,Himself choice group majority like machine.,2024-01-27 17:21:41
Spotify,2640,324,,19,Personal question brother practice.,2024-09-18 19:33:37
Spotify,2641,162,,6,Positive trial final operation.,2024-11-11 06:50:31
Spotify,2642,158,,14,Laugh system public above final staff.,2024-03-21 08:55:40
Spotify,2643,118,,10,Worry type star relationship.,2024-05-08 11:46:53
Spotify,2644,188,,9,Strategy Mr wish middle wear.,2023-12-18 00:22:52
Spotify,2645,370,,17,Condition or all everything relationship.,2024-03-12 19:32:44
Spotify,2646,174,,5,Why all foot pattern experience.,2024-06-14 01:09:41
Spotify,2647,245,82,,Instead fast try imagine they beyond.,2024-06-21 18:07:35
Spotify,2648,120,177,,Reach perform agent hit stage operation.,2024-01-06 21:51:46
Spotify,2649,305,78,,Pull never soldier minute hair make hot.,2024-02-27 19:59:18
Spotify,2650,398,130,,Ask bar once. Candidate act rather chair.,2024-08-21 23:15:03
Spotify,2651,171,,18,Appear would service.,2024-04-21 03:17:51
Spotify,2652,390,188,,Either defense think image. Officer lot sing out.,2024-07-09 05:03:21
Spotify,2653,287,,19,Gas education question dinner go brother.,2024-05-13 08:57:54
Spotify,2654,97,160,,Wind important study early.,2023-12-25 20:57:31
Spotify,2655,107,,8,Whether officer over collection necessary modern.,2024-02-08 01:08:23
Spotify,2656,224,73,,Last top would yourself inside quality level.,2024-10-19 19:44:38
Spotify,2657,209,99,,Side nice me pass positive.,2024-08-28 19:28:00
Spotify,2658,290,65,,Owner practice report Mrs dog.,2024-02-24 03:04:02
Spotify,2659,337,,2,Organization raise four do respond whole.,2023-12-07 14:49:42
Spotify,2660,91,120,,Avoid enjoy industry any.,2024-07-23 07:55:06
Spotify,2661,377,166,,Reach action section lead.,2024-09-30 17:22:21
Spotify,2662,14,95,,Center season say size.,2024-03-21 13:48:35
Spotify,2663,64,,7,Grow consider describe.,2024-06-24 06:30:20
Spotify,2664,269,,12,Mrs effort ago book surface decide.,2024-01-23 12:34:32
Spotify,2665,160,,16,Show gas continue value scientist crime customer.,2024-05-27 16:46:57
Spotify,2666,271,,14,Major compare nor full mouth way share.,2023-12-29 03:38:31
Spotify,2667,261,,16,Trial off forget happy though know painting.,2024-10-25 02:06:42
Spotify,2668,148,32,,Score office matter finish.,2024-07-01 12:05:19
Spotify,2669,289,142,,Manager age last total of.,2024-02-17 12:37:10
Spotify,2670,261,129,,Money light win mention as single.,2024-11-15 18:50:50
Spotify,2671,50,20,,Stand seven want him player.,2024-03-08 23:33:31
Spotify,2672,304,,16,Under central within can fall idea chair.,2024-01-04 17:18:33
Spotify,2673,116,,13,Community design thank personal detail.,2024-05-18 18:52:12
Spotify,2674,276,,3,Few newspaper force simple capital until them.,2024-10-15 21:15:33
Spotify,2675,12,161,,They do what money likely should camera.,2024-11-15 20:37:00
Spotify,2676,135,176,,Son finish manage conference glass.,2024-05-06 04:13:47
Spotify,2677,79,,2,Future itself art choice keep miss.,2024-05-18 05:41:31
Spotify,2678,217,38,,Condition glass whose.,2024-03-17 23:23:08
Spotify,2679,108,,12,Politics court contain paper.,2024-09-04 14:34:02
Spotify,2680,122,50,,Fund stop fund visit yeah cell.,2024-11-18 10:32:55
Spotify,2681,228,,11,Watch because probably. As son if.,2024-03-02 22:48:41
Spotify,2682,104,,16,Tree social must crime.,2024-11-15 04:49:03
Spotify,2683,28,155,,Local left thus very then way parent smile.,2023-12-07 10:19:32
Spotify,2684,301,30,,Matter air seek.,2024-03-28 10:04:29
Spotify,2685,311,77,,Painting analysis attack let voice me effect.,2024-06-16 07:32:23
Spotify,2686,347,78,,Team weight teacher after.,2024-11-03 17:43:32
Spotify,2687,114,84,,Finish individual film work door.,2024-02-17 08:32:12
Spotify,2688,366,,12,Future may adult certainly.,2024-09-29 15:33:23
Spotify,2689,210,41,,Prove sense consider require hear good word.,2024-08-08 18:42:33
Spotify,2690,336,,7,Impact many system body.,2024-02-19 14:56:15
Spotify,2691,58,,1,According certain her.,2024-06-02 17:03:23
Spotify,2692,187,32,,Agent all visit officer. Child visit morning of.,2024-10-24 15:22:03
Spotify,2693,16,78,,Note her amount western.,2023-12-27 11:17:47
Spotify,2694,399,,16,Purpose road chance sound of country.,2024-05-10 07:24:17
Spotify,2695,24,,12,Beyond space two loss worry effort region.,2024-10-22 01:54:20
Spotify,2696,108,,13,Oil middle operation them more get Democrat.,2024-10-26 08:32:57
Spotify,2697,173,,4,Political always be better.,2023-11-26 02:54:50
Spotify,2698,47,,6,Contain fire know lot real still run back.,2024-10-19 04:53:38
Spotify,2699,233,43,,Discover also quite short but. Cup such in.,2024-04-28 23:39:44
Spotify,2700,299,,1,Yard marriage news whose check low mission.,2024-08-16 07:42:31
Spotify,2701,264,173,,Leave bring street.,2024-06-29 16:24:34
Spotify,2702,147,,4,Dog east truth page catch seven.,2023-11-27 11:55:07
Spotify,2703,38,,4,Option see those teacher century none determine.,2024-08-28 19:03:24
Spotify,2704,57,50,,Box act network life watch individual east.,2024-02-24 22:29:54
Spotify,2705,179,,17,Economy behind audience something evidence trade.,2024-04-29 17:05:45
Spotify,2706,31,19,,Happen realize hear manager example.,2024-04-02 14:08:24
