provider_id,post_id,user_id,song_id,album_id,description,created_at
Spotify,4728,354,,11,Property economic kid peace. Record year memory.,2024-10-03 13:03:21
Spotify,4729,76,178,,Reach response almost southern.,2024-04-25 16:40:07
Spotify,4730,210,,15,Itself subject senior few drop make room.,2024-04-19 11:52:44
Spotify,4731,306,70,,Tv yes run court officer.,2024-01-11 20:33:47
Spotify,4732,381,,11,Possible social up popular anyone.,2024-06-21 14:02:17
Spotify,4733,80,8,,Among film teacher future stay the throw.,2024-02-27 22:20:05
Spotify,4734,304,,13,Product food for.,2023-11-25 15:58:11
Spotify,4735,155,,15,Drop industry level.,2023-12-03 20:35:37
Spotify,4736,143,78,,Wear wind within prevent seat gas he.,2024-10-26 16:49:04
Spotify,4737,72,52,,Book us year law. Break view figure effect.,2024-01-31 04:39:07
Spotify,4738,235,186,,Charge center less treatment really north.,2024-01-21 20:33:11
Spotify,4739,285,,2,If bar condition capital onto accept.,2024-08-15 13:47:57
Spotify,4740,62,195,,Magazine old street good drop able.,2024-08-31 12:46:48
Spotify,4741,301,,3,Share too present. I line stop a care.,2024-09-21 10:55:48
Spotify,4742,248,115,,Natural stock might senior base discuss.,2024-07-15 10:12:40
Spotify,4743,198,145,,Pretty feel all yeah law just explain.,2024-11-12 19:28:37
Spotify,4744,36,77,,Attorney happen land behind owner prove.,2024-06-09 03:40:19
Spotify,4745,386,,2,Herself note cut everyone more no seem low.,2024-10-13 16:06:44
Spotify,4746,63,190,,Research difficult behind vote school.,2024-03-17 07:58:57
Spotify,4747,246,,18,Above certainly third group other chair there.,2023-12-02 22:12:44
Spotify,4748,314,45,,Leader good sometimes argue. Look produce line.,2024-05-03 05:30:08
Spotify,4749,198,,5,Herself hot time fear TV.,2023-12-07 19:20:08
Spotify,4750,276,76,,Often local store group simple claim image.,2024-05-10 19:34:45
Spotify,4751,56,,8,Poor across minute wrong us lead community.,2024-10-15 22:59:42
Spotify,4752,262,,7,Might bad former I field.,2024-10-08 12:01:03
Spotify,4753,298,25,,Great rule talk war life.,2024-10-25 00:42:39
Spotify,4754,257,,3,Future beat note population safe.,2024-08-14 17:59:47
Spotify,4755,287,,18,Century cultural stage control south sign.,2024-06-07 16:23:17
Spotify,4756,10,,2,Fear manage mission for likely care page.,2024-05-01 07:40:01
Spotify,4757,68,129,,Different experience discuss yeah foreign site.,2024-03-30 12:34:32
Spotify,4758,313,,7,Card read federal major increase.,2024-07-28 19:25:26
Spotify,4759,28,102,,People our option student training relationship.,2024-05-26 14:34:24
Spotify,4760,363,154,,Keep different enter prevent interview talk bed.,2024-05-08 07:02:44
Spotify,4761,380,107,,Several seek leader myself.,2024-02-12 07:35:52
Spotify,4762,131,118,,Cut resource interesting you each without piece.,2024-10-03 17:52:07
Spotify,4763,303,,13,Six picture left their usually should.,2024-11-08 13:23:05
Spotify,4764,117,,10,Medical worry benefit later court dream set.,2024-06-09 15:20:40
Spotify,4765,249,91,,Cause upon room six soon forget.,2023-12-15 17:58:52
Spotify,4766,114,,7,Sport result mean western.,2024-05-01 04:45:06
Spotify,4767,112,60,,Kitchen me several sure.,2023-12-29 03:29:17
Spotify,4768,118,,9,Stop hold long deal hard.,2024-10-02 00:31:36
Spotify,4769,180,,16,Attorney minute within cup yeah person.,2024-11-13 01:58:03
Spotify,4770,273,172,,Institution south sense him hundred their author.,2024-07-10 00:09:56
Spotify,4771,24,,19,South low likely tree. Answer fly force send.,2024-03-31 09:30:52
Spotify,4772,208,,8,Man character city nor friend may.,2024-09-06 12:14:35
Spotify,4773,289,40,,Data player eye court.,2024-08-06 08:41:22
Spotify,4774,298,77,,Five son yes decade.,2024-03-16 14:21:31
Spotify,4775,31,,15,Analysis medical list per shake break.,2024-03-11 16:42:27
Spotify,4776,286,,8,Site green pressure must assume.,2024-10-11 09:39:04
Spotify,4777,49,8,,Member my since set clearly large amount.,2024-09-10 18:19:08
Spotify,4778,197,,1,Threat generation on reach.,2024-08-27 17:38:24
Spotify,4779,385,,8,Plant we public. Focus mean but performance name.,2024-06-16 07:59:44
Spotify,4780,299,124,,Summer information result also.,2024-06-07 06:49:38
Spotify,4781,225,98,,Door order different production.,2024-01-26 02:52:19
Spotify,4782,238,91,,Risk entire cause friend time from.,2024-07-14 20:37:32
Spotify,4783,173,54,,Within very either glass pick discuss.,2024-05-28 04:28:07
Spotify,4784,301,2,,Society actually opportunity.,2024-06-04 01:59:19
Spotify,4785,175,109,,Per ball account song.,2024-05-12 03:04:31
Spotify,4786,7,78,,Home instead not pattern performance.,2024-10-27 19:18:59
Spotify,4787,298,,5,Small down education cut.,2024-07-31 00:10:48
Spotify,4788,81,,5,Past conference western news professional side.,2023-11-28 04:04:24
Spotify,4789,393,174,,Now each before national seven blood.,2023-11-26 10:19:09
Spotify,4790,279,21,,High dark last. Soon nice blood major.,2024-04-05 20:48:06
Spotify,4791,156,,16,While wonder end result north.,2024-07-12 07:54:41
Spotify,4792,270,104,,Crime care build deep seek.,2023-12-26 00:49:42
Spotify,4793,277,,4,Outside blue become require.,2023-12-07 02:09:55
Spotify,4794,53,,13,Attorney window rate feel.,2024-09-02 11:03:13
Spotify,4795,181,,2,Sell medical too.,2024-01-12 16:18:56
Spotify,4796,48,,11,Him town door not a us.,2024-11-13 20:23:20
Spotify,4797,278,,14,Against school music probably though major poor.,2024-08-26 11:46:41
Spotify,4798,350,101,,Shake heart continue oil ahead fire key.,2024-05-25 23:58:48
Spotify,4799,372,51,,Fund detail require know.,2024-10-27 07:52:50
Apple,0,347,,32,Probably reduce often rest.,2024-04-07 17:49:51
Apple,1,3,258,,Explain house score simply assume up.,2023-12-09 13:42:09
Apple,2,331,276,,Series more old similar police.,2024-04-01 20:35:31
Apple,3,297,,1,Organization for century weight reduce fear.,2024-04-12 17:08:09
Apple,4,105,216,,Carry often standard economic national act.,2024-06-30 13:08:27
Apple,5,119,,11,Approach Republican lead certain begin.,2024-09-14 17:19:00
Apple,6,231,6,,Each three radio three performance social.,2024-09-16 11:04:28
Apple,7,3,,24,Mind arm beautiful account which significant.,2024-08-31 15:38:47
Apple,8,70,,21,Give voice mouth condition past lot history.,2024-08-04 14:05:55
Apple,9,381,109,,Market true tonight many theory risk value.,2024-08-03 03:33:27
Apple,10,242,,3,Identify could half.,2024-07-30 18:48:52
Apple,11,322,,34,Next employee at network.,2024-05-27 07:55:02
Apple,12,261,206,,Design much science class last wrong.,2024-01-15 04:13:14
Apple,13,348,,5,Contain receive message feel.,2024-03-05 01:54:01
Apple,14,5,,25,Design affect attention various TV force really.,2024-05-24 14:02:10
Apple,15,308,21,,Community speech top about change staff role.,2024-01-11 01:29:58
Apple,16,85,164,,Culture decide speak main matter pattern.,2024-11-17 02:00:19
Apple,17,319,,25,Table family ever second their.,2024-07-04 23:38:27
Apple,18,13,,10,Listen body amount staff bed rule.,2024-05-27 19:02:40
Apple,19,272,,1,Wish think toward however.,2024-08-31 15:34:04
Apple,20,5,,13,Him blue or simple player more.,2024-02-08 16:14:09
Apple,21,37,103,,Soon wait time hit. Air everyone instead type.,2024-08-03 18:26:21
Apple,22,307,,25,Line might attorney. Town part which whose.,2023-12-10 13:14:37
Apple,23,279,149,,News particularly born.,2024-02-19 07:18:13
Apple,24,291,,34,Decision key structure know.,2024-04-28 18:07:54
Apple,25,185,,10,Figure party help crime along fish view.,2024-06-26 16:50:01
Apple,26,86,288,,Region always fear father account.,2024-10-28 13:59:39
Apple,27,315,97,,Parent loss night fight quickly operation.,2024-03-31 16:22:47
Apple,28,368,264,,Pretty white myself event executive.,2024-05-15 09:33:26
Apple,29,89,,9,Office worry soldier six.,2024-04-30 21:17:05
Apple,30,8,69,,Final occur close statement deep provide music.,2024-04-27 23:56:46
Apple,31,91,,35,Beat most along least hand certain.,2024-05-22 19:03:17
Apple,32,36,,35,Floor break meet. Family about place.,2024-05-26 23:53:31
Apple,33,168,48,,Can effect today know air within parent.,2024-02-02 06:15:33
Apple,34,90,,3,Of machine official gas address purpose month.,2024-10-11 21:58:20
Apple,35,5,,17,Close Democrat dog everybody might cell.,2024-05-23 07:56:16
Apple,36,119,,9,Cost skill future door better party thus.,2024-05-03 19:03:53
Apple,37,177,,19,Street music attention build control agent.,2024-05-30 21:12:08
Apple,38,227,,3,Offer decision might sense focus out home.,2024-08-14 13:25:07
Apple,39,106,,32,Than young might kid alone religious support.,2024-09-25 21:30:56
Apple,40,121,217,,Owner remain represent public charge.,2024-08-19 11:26:07
Apple,41,19,,30,Life executive reveal act major wide long.,2024-01-31 18:41:16
Apple,42,163,,30,Visit authority during mother.,2024-11-14 15:44:33
Apple,43,184,256,,The sing may send.,2024-03-10 07:11:39
Apple,44,68,,7,Wonder reduce threat worker guy staff.,2024-09-27 07:28:24
Apple,45,308,37,,International result property result.,2024-10-19 13:05:16
Apple,46,235,239,,Car financial film trouble price out.,2023-12-28 07:06:55
Apple,47,160,89,,Fire order every develop.,2024-07-10 12:23:09
Apple,48,274,239,,Situation local kitchen she effort movement.,2024-05-21 06:37:30
Apple,49,81,,3,Response how morning experience what join soon.,2024-04-02 03:01:44
Apple,50,319,,16,Speak throw seven page audience product.,2024-04-01 17:37:30
Apple,51,180,,31,Thought production result hand.,2023-12-04 02:29:59
Apple,52,328,,5,Man fly change seem.,2024-07-25 18:33:29
Apple,53,200,,24,That understand above.,2024-06-16 21:22:14
Apple,54,219,,31,College day care or base.,2023-12-14 05:02:53
Apple,55,28,90,,Others admit outside. A whatever ten student.,2024-11-07 16:46:45
Apple,56,89,,8,History approach window country.,2024-03-14 06:29:17
Apple,57,291,10,,Less water trouble toward suddenly last.,2024-05-19 16:01:36
Apple,58,128,,32,List front tell PM free sort.,2024-07-02 20:08:30
Apple,59,284,,2,First than fund kid. We also official young.,2024-10-02 12:21:50
Apple,60,173,,20,Happy street beat road rate huge.,2024-09-16 05:50:24
Apple,61,306,,22,Pull red through tonight deep if.,2024-01-18 04:05:47
Apple,62,394,,22,Remain modern education office among.,2024-03-18 05:22:49
Apple,63,196,,29,Play computer station write under if.,2023-11-22 07:50:48
Apple,64,16,271,,Ask pressure national keep.,2024-04-23 22:55:50
Apple,65,82,,13,Notice huge can for. There side get source.,2024-08-19 10:01:33
Apple,66,360,189,,Have head garden measure.,2024-04-30 06:23:24
Apple,67,12,22,,From water hospital smile Congress save.,2023-12-12 05:13:56
Apple,68,64,252,,Her then agree participant.,2024-05-22 08:54:17
Apple,69,272,,19,Tv them own agreement administration condition.,2024-09-02 09:42:03
Apple,70,24,39,,Cut maybe others home here add.,2024-10-02 07:28:09
Apple,71,196,282,,Dark tend authority bill ten middle.,2024-09-15 01:01:26
Apple,72,77,,26,Just market air front her care.,2024-03-31 22:21:57
Apple,73,370,252,,Some under support feeling.,2023-11-30 06:16:49
Apple,74,332,34,,Left fine audience culture large us staff leave.,2024-05-20 21:57:47
Apple,75,83,,29,Wrong break see yard.,2024-09-30 09:33:20
Apple,76,191,44,,Say positive party safe time.,2024-08-15 01:18:02
Apple,77,287,56,,Why during his along.,2024-09-10 03:31:51
Apple,78,232,233,,Single do many significant number book.,2024-06-04 13:44:35
Apple,79,361,,1,Gas citizen ball cut imagine player address role.,2024-06-24 12:28:27
Apple,80,339,,29,Car may raise peace.,2024-06-07 14:36:02
Apple,81,369,63,,Above sense eight.,2024-04-03 15:11:48
Apple,82,295,198,,Follow old painting word assume suddenly.,2024-05-15 12:36:02
Apple,83,353,,25,Employee tree economy.,2024-06-04 23:52:52
Apple,84,310,,14,Almost street less sport event record total.,2024-11-01 14:33:26
Apple,85,120,5,,Pull your agency.,2024-05-17 06:38:58
Apple,86,397,,13,Traditional deal office method.,2024-06-05 13:39:05
Apple,87,283,182,,Movement control finally senior.,2024-05-17 19:15:40
Apple,88,58,78,,Talk fight wear partner between everyone black.,2024-02-01 03:42:58
Apple,89,20,112,,Medical look result pay husband stop account.,2024-07-12 15:22:15
Apple,90,360,212,,Where down human thus say.,2024-02-14 19:25:28
Apple,91,229,116,,Agent today know husband might.,2024-09-04 07:02:41
Apple,92,146,48,,Who environment coach.,2024-04-26 12:56:20
Apple,93,301,,35,Wife choice task type appear.,2024-10-22 07:57:41
Apple,94,303,188,,Piece sit class memory become.,2023-12-09 23:04:55
Apple,95,248,,22,Heavy all skill add result.,2023-11-22 06:13:58
Apple,96,89,,5,Out total these free. Concern seat share she.,2024-09-15 07:41:05
Apple,97,213,,21,Certainly center west another.,2024-06-17 17:08:46
Apple,98,371,,28,Woman toward prove point up series case minute.,2024-01-26 15:04:26
Apple,99,315,51,,Because church watch box step yet.,2024-04-18 18:11:10
Apple,100,84,,18,Onto collection might weight together.,2024-06-03 19:29:54
Apple,101,233,,29,Later visit then share necessary fire.,2024-08-29 11:36:36
Apple,102,177,,1,Somebody media thought tough score.,2024-07-31 04:37:47
Apple,103,100,182,,Conference similar never road own time over.,2024-05-21 00:53:51
Apple,104,397,,9,Meet training deal PM. Low include around write.,2023-12-28 20:45:42
Apple,105,120,69,,Physical whose bit value strong my kitchen put.,2023-12-19 10:12:08
Apple,106,62,,17,Require wear floor not. Seat end eight yet.,2024-10-19 18:38:43
Apple,107,45,,16,Century begin third big project yet serious.,2024-08-16 08:19:07
Apple,108,362,221,,Local together firm.,2023-12-01 06:42:54
Apple,109,171,68,,First agree south camera performance move.,2024-04-24 03:08:11
Apple,110,147,120,,Place imagine all green process final country.,2024-07-23 11:30:27
Apple,111,255,136,,Government type tax west mind late.,2024-03-13 01:48:13
Apple,112,9,111,,Production since down very analysis each.,2024-02-08 02:27:49
Apple,113,330,108,,Nor or image foreign should buy.,2024-02-24 10:25:14
Apple,114,78,,10,Believe allow decide pretty fall collection open.,2024-01-08 22:30:17
Apple,115,339,279,,Pattern worry choose hold note understand.,2024-06-16 14:53:16
Apple,116,298,,20,Even church go better card.,2024-02-06 04:23:19
Apple,117,71,,5,Simple attorney rule population fly challenge.,2024-11-01 04:14:42
Apple,118,47,207,,Never until sport. Land chair citizen.,2024-08-21 20:21:52
Apple,119,35,23,,Long leg hand young west military.,2024-10-26 19:54:16
Apple,120,247,,25,Area even approach scene player among decide.,2024-10-02 01:50:46
Apple,121,194,,28,Rather rest maintain.,2024-07-27 03:35:52
Apple,122,223,278,,Figure word field produce its wrong.,2024-02-15 14:22:20
Apple,123,214,181,,Sing million ability enter no goal born pretty.,2024-03-17 10:21:13
Apple,124,76,,35,Movement financial watch.,2024-09-12 02:09:33
Apple,125,166,98,,Local score place long sell hand.,2024-08-09 13:56:05
Apple,126,198,,5,Food individual impact current.,2024-04-14 21:12:57
Apple,127,224,289,,Focus fast hot show stuff rate husband.,2024-02-16 09:01:57
Apple,128,210,,34,Age home mouth affect deep.,2024-04-03 18:05:11
Apple,129,203,262,,During time operation capital piece meet.,2024-11-03 02:25:56
Apple,130,197,,28,Idea relationship class foot.,2024-06-05 19:46:49
Apple,131,170,16,,Piece foot seek reach particularly agent.,2023-11-24 18:46:51
Apple,132,160,271,,But company soldier field itself determine seat.,2024-03-12 04:25:54
Apple,133,390,,17,Either so scientist million sport.,2024-07-08 16:35:10
Apple,134,218,249,,All action than always since could main.,2024-07-12 08:32:09
Apple,135,343,,31,City with week major.,2024-08-05 13:02:02
Apple,136,89,,11,Future alone do get.,2024-09-17 19:31:01
Apple,137,124,276,,Sister against century talk many side it.,2023-11-24 20:42:38
Apple,138,151,,11,Painting garden kid thank action total.,2024-08-25 06:53:10
Apple,139,274,,35,Shake far with past sure church.,2023-11-30 00:16:30
Apple,140,300,,34,Others arrive pattern call plant friend.,2024-01-11 14:05:50
Apple,141,37,127,,Meet level onto report receive.,2024-05-10 17:32:15
Apple,142,106,176,,Somebody six Mrs white.,2024-06-02 21:29:03
Apple,143,210,,28,Miss study into high difference.,2023-12-30 19:34:50
Apple,144,37,184,,Note music every popular member soon yet.,2024-02-02 15:08:20
Apple,145,33,173,,Mrs until fish remember present another add ok.,2024-02-18 04:42:01
Apple,146,162,133,,Police try business image.,2024-10-30 11:42:18
Apple,147,250,,35,Hope unit heart.,2024-02-09 09:45:24
Apple,148,171,,11,Seek fire center detail home letter house drug.,2024-05-14 01:48:48
Apple,149,299,,16,South get energy end population kind.,2024-05-16 08:07:10
Apple,150,177,,15,Save hair state human account. Red race author.,2023-12-22 14:30:19
Apple,151,34,199,,Real compare wrong must listen it put.,2024-08-19 23:44:43
Apple,152,58,144,,Cup join meet. Again base only do state.,2024-08-22 08:25:59
Apple,153,181,,2,Their daughter huge case field.,2024-05-23 01:08:35
Apple,154,159,,16,American sound whatever economic community.,2024-06-20 16:57:40
Apple,155,165,,20,Summer call attack improve hit.,2024-08-31 05:22:08
Apple,156,350,,5,Already early room. Make class event certain low.,2024-11-06 20:06:41
Apple,157,42,62,,Thought write forget again even easy major.,2024-09-21 07:08:23
Apple,158,369,133,,Science player local sometimes.,2024-05-11 17:51:30
Apple,159,240,250,,Message response wait realize population tree.,2024-02-02 15:22:45
Apple,160,154,107,,Dinner team letter town foreign human increase.,2024-10-10 11:20:57
Apple,161,236,195,,Size weight last stand.,2024-04-06 23:00:05
Apple,162,314,25,,Sell act garden risk necessary speak.,2023-11-30 22:42:30
Apple,163,67,133,,Decision Congress computer public.,2024-04-25 05:15:54
Apple,164,62,,1,Partner eat deep. Third hope network.,2024-08-05 07:16:25
Apple,165,87,88,,Agreement reason administration former.,2024-03-30 14:17:38
Apple,166,81,,31,Have left all final billion light.,2024-09-24 18:28:18
Apple,167,80,,10,Property believe bad power.,2024-08-22 04:00:34
Apple,168,236,,15,Staff research whatever him spring.,2024-08-24 15:30:56
Apple,169,92,,16,Piece environment tree school.,2024-03-17 21:41:52
Apple,170,288,,10,Full other walk listen president particularly.,2024-03-12 05:03:52
Apple,171,335,,27,Subject deal once could important.,2024-03-14 13:19:43
Apple,172,340,131,,Idea blood plant ball happen.,2024-08-08 07:37:36
Apple,173,203,,34,Sense consumer money court mean wall.,2024-06-17 17:35:38
Apple,174,165,1,,Sister court agency interview sing factor anyone.,2023-12-10 19:13:00
Apple,175,17,,31,Others when exist toward.,2024-09-04 22:12:09
Apple,176,365,,8,Score inside structure cause.,2024-07-26 07:04:06
Apple,177,246,,2,Book again simple dark worry.,2024-07-02 12:19:47
Apple,178,206,288,,Smile reveal project party.,2024-10-24 04:37:49
Apple,179,289,209,,Them while begin address begin attack true.,2024-03-13 07:26:48
Apple,180,356,,2,Discover least time media.,2024-09-11 11:42:47
Apple,181,95,251,,Young professor peace.,2024-03-17 23:24:18
Apple,182,365,7,,Heart condition office.,2024-04-20 00:04:41
Apple,183,87,210,,Think a a number financial throw read.,2024-11-07 13:11:38
Apple,184,214,255,,Imagine position hear. Admit group me into act.,2024-08-07 01:10:22
Apple,185,42,,9,Weight laugh likely response.,2024-10-19 18:50:05
Apple,186,181,,25,Congress because happy when game natural those.,2024-07-26 13:14:52
Apple,187,43,18,,Design able lot with camera much. Night whole PM.,2024-01-27 08:59:56
Apple,188,271,,13,Coach room economic truth.,2024-05-06 14:40:52
Apple,189,65,21,,Ever tonight bit factor.,2023-11-22 14:59:33
Apple,190,114,,35,Use shoulder child life hear figure type partner.,2024-08-03 20:02:21
Apple,191,268,,7,Ability answer offer.,2024-07-16 20:24:00
Apple,192,385,252,,Seek sport human policy especially as who.,2024-05-22 12:57:53
Apple,193,278,223,,Just shake spring push section machine green.,2024-07-21 15:53:56
Apple,194,180,,2,Laugh leg pick tax that least.,2024-04-12 19:47:58
Apple,195,305,125,,Very challenge growth. Finally class a test.,2023-11-28 05:44:13
Apple,196,11,84,,Able serious energy option us.,2024-02-14 03:39:45
Apple,197,369,,33,Cultural question herself.,2024-02-13 20:28:58
Apple,198,327,31,,Under majority agent game high prevent score.,2024-01-07 17:42:34
Apple,199,342,,2,Agree later difficult.,2024-11-10 07:01:35
Apple,200,119,,20,Reduce push Mr half.,2023-11-28 11:03:24
Apple,201,389,,14,Owner friend prove movie.,2024-09-26 16:30:43
Apple,202,84,,4,Follow democratic politics.,2024-02-19 01:26:25
Apple,203,110,,16,Look power information course road model new.,2024-02-21 13:07:48
Apple,204,318,,10,Painting fine cultural there talk rather.,2024-03-24 23:57:43
Apple,205,86,235,,Down actually security drive generation.,2024-06-30 12:45:29
Apple,206,303,113,,Matter part behavior. Force gas number each.,2024-09-24 14:53:04
Apple,207,226,,23,Young government court bill source.,2024-03-16 15:20:32
Apple,208,124,236,,Theory shoulder above enjoy dinner care talk.,2024-02-17 05:13:06
Apple,209,314,,23,Federal base rest health hard character.,2024-09-23 14:02:22
Apple,210,183,,19,Life win year call establish keep.,2024-09-12 04:57:09
Apple,211,394,,19,Conference require miss.,2024-05-27 03:40:14
Apple,212,100,48,,Soldier prevent effort recent because line.,2024-10-29 17:26:09
Apple,213,163,,12,Book pretty firm gas only want expert.,2024-05-10 00:16:14
Apple,214,325,,13,Step under put free become.,2024-10-23 08:35:53
Apple,215,180,,3,Test myself though edge.,2024-05-12 14:02:20
Apple,216,186,,2,From challenge girl fine because huge.,2024-07-18 20:20:23
Apple,217,216,126,,Fund economy between.,2024-03-09 05:08:32
Apple,218,388,,1,Section blood color seem her middle.,2024-06-08 01:49:31
Apple,219,206,,6,Month act world nearly daughter require.,2024-04-02 13:39:58
Apple,220,40,166,,Manager reveal example perhaps.,2024-09-13 05:18:19
Apple,221,18,68,,Bit take they figure.,2024-03-01 12:52:45
Apple,222,221,,1,Drop as stock change story.,2024-11-07 06:23:28
Apple,223,320,38,,Similar successful teacher theory.,2024-08-12 11:23:20
Apple,224,306,114,,Energy enjoy mouth address.,2024-10-21 09:06:52
Apple,225,372,17,,Peace beat continue health difference him son.,2024-01-18 21:38:15
Apple,226,28,,30,Event field election hundred event material.,2023-12-20 02:46:04
Apple,227,348,4,,Material state here peace amount section cut.,2024-11-12 04:01:23
Apple,228,237,134,,Ever blood audience. Article very measure just.,2024-06-02 13:09:22
Apple,229,265,19,,Prepare poor owner box pattern theory pick.,2024-11-03 17:40:43
Apple,230,245,32,,Mean side thank appear return apply pretty.,2024-11-16 17:02:03
Apple,231,229,,8,Budget simply drive ability.,2024-08-27 10:27:19
Apple,232,59,60,,Dog least result because kind.,2024-05-15 17:53:09
Apple,233,112,,7,End particularly effort message point.,2024-03-08 07:52:09
Apple,234,56,,28,Person social wall stand bag trouble raise.,2023-12-31 22:31:07
Apple,235,139,,32,Know land along old until dream region.,2024-08-15 02:30:29
Apple,236,334,98,,Senior visit account beautiful walk court.,2024-10-10 21:56:27
Apple,237,130,,6,Chance near school during process public.,2024-11-14 07:57:51
Apple,238,5,,16,Still glass cell hair fly rather candidate.,2024-01-07 20:42:44
Apple,239,224,,30,Also sport whose while black.,2024-05-29 07:49:19
Apple,240,387,,9,Politics guy church Republican none.,2024-03-08 06:53:26
Apple,241,352,,18,Affect laugh dream item region.,2024-06-08 00:43:05
Apple,242,205,,3,Let people position voice might.,2024-04-27 18:40:42
Apple,243,234,,2,Issue prove Congress position family wife.,2024-03-12 08:41:34
Apple,244,350,46,,Describe read prepare management federal popular.,2024-02-12 10:54:22
Apple,245,309,,8,Admit only operation month. Well piece public.,2024-07-20 17:04:14
Apple,246,124,45,,Wide rise hundred can itself.,2024-04-30 09:46:04
Apple,247,264,,5,Quickly course their enough respond.,2024-04-10 07:06:21
Apple,248,272,,7,Test middle spring college economic.,2024-10-02 19:22:13
Apple,249,351,,19,Case really artist field would.,2024-06-07 15:58:18
Apple,250,58,53,,Into defense clearly yet relate song other.,2024-07-29 16:31:44
Apple,251,396,,3,Up want interest play trade half.,2024-08-02 23:39:16
Apple,252,352,4,,Election dream space different stock hope raise.,2024-10-05 03:34:27
Apple,253,282,21,,Animal east matter late senior foreign.,2024-10-12 04:13:27
Apple,254,319,,9,Half type address rock yes worry especially.,2024-05-13 19:53:59
Apple,255,165,,3,Exactly left about left.,2023-12-16 11:31:47
Apple,256,116,,2,End industry when sign future meet community.,2024-01-01 21:24:32
Apple,257,277,,33,Forget physical after front and its establish.,2024-01-08 14:19:38
Apple,258,292,,17,School mouth Mrs light fire beyond.,2024-01-14 03:16:15
Apple,259,99,278,,Scene indicate do our coach discussion manage.,2023-12-04 20:44:13
Apple,260,18,171,,Today beyond serious short most any.,2024-10-07 00:16:02
Apple,261,3,153,,Remember which under.,2024-09-02 11:45:34
Apple,262,191,102,,Staff another meeting majority paper apply.,2024-05-29 17:36:57
Apple,263,335,209,,Its beautiful keep remain maybe lead.,2023-12-24 01:06:59
Apple,264,128,21,,Position build someone money kid.,2024-05-02 14:38:10
Apple,265,175,,10,Home almost type answer listen election.,2024-07-13 22:50:04
Apple,266,291,,29,Back movement environment hit age wind analysis.,2024-10-25 12:25:05
Apple,267,48,264,,Candidate my few little entire since.,2024-08-03 00:28:56
Apple,268,251,178,,Ability before want Democrat vote film.,2024-03-03 06:15:31
Apple,269,161,189,,Simply rather safe world game job.,2024-08-01 18:55:20
Apple,270,401,169,,Ahead like trip look condition floor song.,2024-06-23 10:10:26
Apple,271,234,205,,Evidence authority easy church listen of.,2024-10-29 11:37:51
Apple,272,349,74,,Letter organization break.,2024-09-09 21:14:04
Apple,273,23,252,,Agent practice artist western.,2024-05-19 04:50:56
